text,tags,createdAt,updatedAt,AuthorId,PostID,norm_text,labels,scores
Bring the boys home.  Stop protecting other countries!,"{""""}",2020-09-03 21:54:03.379000+00:00,2020-09-03 21:54:16.364000+00:00,2567,393,Bring the boys home Stop protecting other countries,negative,0.860359251499176
Bring the boys home.  Stop protecting other countries!,"{""""}",2020-09-03 21:54:03.823000+00:00,2020-09-03 21:54:16.371000+00:00,2567,394,Bring the boys home Stop protecting other countries,negative,0.860359251499176
Bring the boys home.  Stop protecting other countries!,"{""""}",2020-09-03 21:54:04.482000+00:00,2020-09-03 21:54:16.387000+00:00,2567,395,Bring the boys home Stop protecting other countries,negative,0.860359251499176
Bring the boys home.  Stop protecting other countries!,"{""""}",2020-09-03 21:54:16.365000+00:00,2020-09-03 21:54:16.465000+00:00,2567,396,Bring the boys home Stop protecting other countries,negative,0.860359251499176
Bring the boys home.  Stop protecting other countries!,"{""""}",2020-09-03 21:54:16.365000+00:00,2020-09-03 21:54:16.465000+00:00,2567,397,Bring the boys home Stop protecting other countries,negative,0.860359251499176
Bring the boys home.  Stop protecting other countries!,"{""""}",2020-09-03 21:54:16.366000+00:00,2020-09-03 21:54:16.465000+00:00,2567,398,Bring the boys home Stop protecting other countries,negative,0.860359251499176
Bring the boys home.  Stop protecting other countries!,"{""""}",2020-09-03 21:54:16.380000+00:00,2020-09-03 21:54:16.484000+00:00,2567,399,Bring the boys home Stop protecting other countries,negative,0.860359251499176
There have not been nearly enough long term studies into potential harm caused by GMOs.   Big agribusiness doesn't care about our safety!,"{GMO,nomutantfood}",2020-09-03 21:56:50.220000+00:00,2020-09-03 21:56:50.228000+00:00,2667,400,There have not been nearly enough long term studies into potential harm caused by GMOs Big agribusiness doesnt care about our safety,negative,0.8901084661483765
"Nuclear Energy is worse for the environment than COAL!!!
https://www.marketwatch.com/story/think-fossil-fuels-are-bad-nuclear-energy-is-even-worse-2019-10-17","{""""}",2020-09-03 21:57:00.930000+00:00,2020-09-03 21:57:03.471000+00:00,2568,401,Nuclear Energy is worse for the environment than COAL ,negative,0.9772852063179016
We as a country have so many issues on our plate.  Not the least of which being an out of control pandemic raging in our country.  Time to stop saving the world and practice some self care as a country for awhile.,"{proudAmerican,AmericanSelfCare}",2020-09-03 21:59:15.524000+00:00,2020-09-03 21:59:15.536000+00:00,2667,402,We as a country have so many issues on our plate Not the least of which being an out of control pandemic raging in our country Time to stop saving the world and practice some self care as a country for awhile,negative,0.687552809715271
"The market went down today, I think by the end of the year it will be much lower. I think people are realizing the economy is in bad shape and some jobs might not even come back.","{""""}",2020-09-03 22:04:10.188000+00:00,2020-09-03 22:04:10.198000+00:00,2454,403,The market went down today I think by the end of the year it will be much lower I think people are realizing the economy is in bad shape and some jobs might not even come back,negative,0.9902559518814087
"The U.S. has the highest number of COVID 19 cases in the world but as of today mask wearing and social distancing policies are barely being enforced and required. We need policies in place, preferably on the federal level to stop the spread of this virus,  https://www.statista.com/chart/21467/coutries-most-covid-19-cases/.",{wearamask},2020-09-03 22:04:54.951000+00:00,2020-09-03 22:04:54.962000+00:00,2701,404,The US has the highest number of COVID cases in the world but as of today mask wearing and social distancing policies are barely being enforced and required We need policies in place preferably on the federal level to stop the spread of this virus ,negative,0.6877353191375732
"If GMO foods are safe, why do so many people experience health improvements after switching to GMO free food?  Check out the article below and get the facts about GMO food !  
https://www.shape.com/healthy-eating/diet-tips/possible-health-risks-gmos-gmo-foods","{GMO,nomutantfood}",2020-09-03 22:06:17.062000+00:00,2020-09-03 22:06:17.071000+00:00,2667,405,If GMO foods are safe why do so many people experience health improvements after switching to GMO free food Check out the article below and get the facts about GMO food ,negative,0.680732786655426
"Poll:  Which is more important to you?  The economy or the environment?
Can we have both do well?","{economy,environment}",2020-09-03 22:12:13.690000+00:00,2020-09-04 22:28:59.206000+00:00,2658,406,Poll Which is more important to you The economy or the environment Can we have both do well,positive,0.6498444080352783
"The Dow has been falling badly again today.  With all the uncertainty from the pandemic situation, it seems unlikely to reach last February's high point by the end of this year https://www.cnn.com/2020/09/03/investing/nasdaq-selloff-stock-market-today/index.html",{dowisgoingdown},2020-09-03 22:12:49.998000+00:00,2020-09-03 22:12:50.007000+00:00,2667,407,The Dow has been falling badly again today With all the uncertainty from the pandemic situation it seems unlikely to reach last Februarys high point by the end of this year ,negative,0.9547079205513
"Terror is going to happen any time. Our leader is ignoring the signs. We must get Trump out of office so someone like Biden can pay attention. Save us all Biden.

# SaveusJoe","{"""",SaveusJoe}",2020-09-03 22:18:00.204000+00:00,2020-09-03 22:18:00.223000+00:00,2387,408,Terror is going to happen any time Our leader is ignoring the signs We must get Trump out of office so someone like Biden can pay attention Save us all Biden SaveusJoe,negative,0.8829380869865417
"COVID 19 began in China but yet they were able to control the spread, https://www.worldometers.info/coronavirus/country/china/. The U.S. is doing a horrible job controlling the spread of the Coronavirus. ",{wearamask},2020-09-03 22:18:06.962000+00:00,2020-09-03 22:18:06.972000+00:00,2701,409,COVID began in China but yet they were able to control the spread The US is doing a horrible job controlling the spread of the Coronavirus ,negative,0.8854639530181885
"With everything our country is going through, it's really important that we pull together, support each other as Americans, and focus on our own country and getting through tough times together.","{ProudAmerican,AmericaSelfCare}",2020-09-03 22:18:55.556000+00:00,2020-09-03 22:18:55.566000+00:00,2667,410,With everything our country is going through its really important that we pull together support each other as Americans and focus on our own country and getting through tough times together,positive,0.5067803263664246
"I feel like I am living in a sci-fi movie. People walking around in masks. People wearing gloves in the stores. Tents in parking lots if I want to workout, if I want to eat. Come on! The government is overdoing it on the Covid restrictions. Give me a break!!","{Whitehouse,GiveUsABreak,CovidorNotCovid,NoMoreRestrictions}",2020-09-03 22:20:22.334000+00:00,2020-09-03 22:20:22.345000+00:00,2655,411,I feel like I am living in a scifi movie People walking around in masks People wearing gloves in the stores Tents in parking lots if I want to workout if I want to eat Come on The government is overdoing it on the Covid restrictions Give me a break,negative,0.5288029313087463
"https://www.cnn.com/2020/07/25/politics/us-protests-trump-terrorists-intl/index.html
Trump calls peaceful protesters terrorists while he lets the real terror grow in our midst. Look at Kenosha, the murderer there is a 17 year old devotee of Trump. 
# TrumpISterror","{"""",TrumpISterror}",2020-09-03 22:20:49.060000+00:00,2020-09-03 22:20:49.069000+00:00,2387,412, Trump calls peaceful protesters terrorists while he lets the real terror grow in our midst Look at Kenosha the murderer there is a year old devotee of Trump TrumpISterror,negative,0.7750482559204102
"What's the real truth? Trump CALLS people terrorists but he doesn't pay any attention to the real dangers. Check the facts: https://www.factcheck.org/issue/terrorism/

# Checkterrornow","{"""",Checkterrornow}",2020-09-03 22:22:59.143000+00:00,2020-09-03 22:22:59.151000+00:00,2387,413,Whats the real truth Trump CALLS people terrorists but he doesnt pay any attention to the real dangers Check the facts Checkterrornow,negative,0.9115128517150879
"Eating GMO foods can contribute to the growing problem of antibiotic resistance in humans, as some GMO foods contain genes to make them antibiotic resistant.  This can have a long term impact on human health!","{GMO,NoMutantFood}",2020-09-03 22:24:07.484000+00:00,2020-09-03 22:24:07.492000+00:00,2667,414,Eating GMO foods can contribute to the growing problem of antibiotic resistance in humans as some GMO foods contain genes to make them antibiotic resistant This can have a long term impact on human health,positive,0.8361645340919495
"It looks like we're not going to get a coordinated federal response to the covid virus until Joe Biden comes into office.  So, over 4 months left until we can return to normal.","{covid,biden2020}",2020-09-03 22:27:53.448000+00:00,2020-09-03 22:27:53.472000+00:00,2622,415,It looks like were not going to get a coordinated federal response to the covid virus until Joe Biden comes into office So over months left until we can return to normal,negative,0.9661350846290588
"It's becoming more likely that there will be a terrorist attack thanks to our incompetent leadership. Check out this report: https://www.ncjrs.gov/pdffiles1/nij/251789.pdf

# Winteriscoming","{"""",Winteriscoming}",2020-09-03 22:28:18.981000+00:00,2020-09-03 22:28:21.260000+00:00,2387,416,Its becoming more likely that there will be a terrorist attack thanks to our incompetent leadership Check out this report Winteriscoming,negative,0.9812896251678467
"With an out of control pandemic, an economy that's not much better, and ongoing racial tension, it's time for America to take a sick day and focus on our own problems instead of fixing other countries' problems for a change.  America really needs to spend some time in bed with some tea and chicken noodle soup.","{ProudAmerican,AmericaSelfCare}",2020-09-03 22:29:44.356000+00:00,2020-09-03 22:29:44.364000+00:00,2667,417,With an out of control pandemic an economy thats not much better and ongoing racial tension its time for America to take a sick day and focus on our own problems instead of fixing other countries problems for a change America really needs to spend some time in bed with some tea and chicken noodle soup,negative,0.9755523800849915
I 100% agree Russia and China are dangerous threats. ,,2020-09-03 22:37:12.403000+00:00,2020-09-03 22:37:12.409000+00:00,2654,418,I agree Russia and China are dangerous threats ,negative,0.9113669991493225
I feel the chances of the US experiencing a terrorist attack in the next ten years are very high and we need to do whatever we can to support each other.,"{""""}",2020-09-03 22:45:54.312000+00:00,2020-09-03 22:45:56.434000+00:00,2714,419,I feel the chances of the US experiencing a terrorist attack in the next ten years are very high and we need to do whatever we can to support each other,negative,0.8474889397621155
I think that the USA has to take an active position around the world. We need to make sure that the world stays safe!,{USANUMBER1},2020-09-03 22:46:11.257000+00:00,2020-09-03 22:46:21.812000+00:00,2615,420,I think that the USA has to take an active position around the world We need to make sure that the world stays safe,positive,0.8739641904830933
I think that the USA has to take an active position around the world. We need to make sure that the world stays safe!,{USANUMBER1},2020-09-03 22:46:19.489000+00:00,2020-09-03 22:46:47.317000+00:00,2615,421,I think that the USA has to take an active position around the world We need to make sure that the world stays safe,positive,0.8739641904830933
I can't be the only one who thinks we need to increase the taxes on the rich!,"{""""}",2020-09-03 22:46:52.748000+00:00,2020-09-03 22:46:57.457000+00:00,2615,422,I cant be the only one who thinks we need to increase the taxes on the rich,negative,0.9233262538909912
I can't be the only one who thinks we need to increase the taxes on the rich!,"{""""}",2020-09-03 22:46:56.837000+00:00,2020-09-03 22:47:04.797000+00:00,2615,423,I cant be the only one who thinks we need to increase the taxes on the rich,negative,0.9233262538909912
Our healthcare system needs to change. We all know it.,{Healtcare},2020-09-03 22:47:25.753000+00:00,2020-09-03 22:47:31.951000+00:00,2615,424,Our healthcare system needs to change We all know it,negative,0.8932657837867737
"We have to get back into the Paris accords: https://www.whitehouse.gov/briefings-statements/statement-president-trump-paris-climate-accord/
Time is ticking. Our kids and grandkids (face it, ourselves) are going to be endangered. We have to get back with the world to save the world.

# JoinWorldParisaccords","{"""",JoinWorldParisaccords}",2020-09-03 22:47:29.097000+00:00,2020-09-03 22:47:32.822000+00:00,2391,425,We have to get back into the Paris accords Time is ticking Our kids and grandkids face it ourselves are going to be endangered We have to get back with the world to save the world JoinWorldParisaccords,positive,0.6758785247802734
"wildfires are out of control here in California. I just barely survived the one that now is being put out one hilltop away from me. We have to do something about global warming before it's too late. Wildfire season is just beginning here. Global warming is real.

# Warmingisburning","{"""",Warmingisburning}",2020-09-03 22:51:24.613000+00:00,2020-09-03 22:51:24.621000+00:00,2387,426,wildfires are out of control here in California I just barely survived the one that now is being put out one hilltop away from me We have to do something about global warming before its too late Wildfire season is just beginning here Global warming is real Warmingisburning,negative,0.524702787399292
"We need to do more for our poor coastal areas. Stop global warming now.  Hurricanes hit Louisiana and the gulf coast. Let's do something to stop global warming.

# Stopthehurricanes","{"""",Stopthehurricanes}",2020-09-03 22:53:50.095000+00:00,2020-09-03 22:53:54.162000+00:00,2387,427,We need to do more for our poor coastal areas Stop global warming now Hurricanes hit Louisiana and the gulf coast Lets do something to stop global warming Stopthehurricanes,positive,0.7115366458892822
Dow Jones will most likely be down 20% at the end of the year from its peak in February 2020,"{""""}",2020-09-03 23:09:42.558000+00:00,2020-09-03 23:09:46.211000+00:00,2714,428,Dow Jones will most likely be down at the end of the year from its peak in February ,negative,0.8096693754196167
"Using nuclear energy to provide electricity to Americans in the United States sounds like a great idea to begin with, until you look at how much damage it does to the environment. What if a catastrophe was to happen? Look at the Fukushima meltdown in Japan for example, we can't afford to have something as tragic as that happen here.","{nuclearenergy,unitedstates,nuclearpower}",2020-09-03 23:14:13.579000+00:00,2020-09-03 23:14:13.588000+00:00,2663,429,Using nuclear energy to provide electricity to Americans in the United States sounds like a great idea to begin with until you look at how much damage it does to the environment What if a catastrophe was to happen Look at the Fukushima meltdown in Japan for example we cant afford to have something as tragic as that happen here,negative,0.6062434911727905
"America would be handling all of our crisis better if we worked with other countries better, especially the COVID19 pandemic. We need to be more involved in world affairs?

#COVID19","{""""}",2020-09-03 23:15:37.014000+00:00,2020-09-03 23:15:37.024000+00:00,2610,430,America would be handling all of our crisis better if we worked with other countries better especially the COVID pandemic We need to be more involved in world affairs COVID ,positive,0.6717567443847656
Serious question for all: Who are America's allies? What countries do we still get along with?,"{""""}",2020-09-03 23:16:20.825000+00:00,2020-09-03 23:16:20.836000+00:00,2610,431,Serious question for all Who are Americas allies What countries do we still get along with,positive,0.516089141368866
"Since the US is such a big contributor to environmental issues (greenhouse gas anyone?), I believe that the US should take priority in protecting the environment even if the economy is curbed. I mean, how are we gonna have an economy if we can't breathe outside or our planet is on fire? Don't let greed ruin the green!","{economy,greenhouse,economics,environment}",2020-09-03 23:16:33.264000+00:00,2020-09-03 23:16:33.273000+00:00,2663,432,Since the US is such a big contributor to environmental issues greenhouse gas anyone I believe that the US should take priority in protecting the environment even if the economy is curbed I mean how are we gonna have an economy if we cant breathe outside or our planet is on fire Dont let greed ruin the green,negative,0.6338598132133484
"This has been talked about for decades, but what if the American health care system was never tied to employment? Would we be better off? We need to blow up how America does health care.","{""""}",2020-09-03 23:17:58.726000+00:00,2020-09-03 23:18:00.459000+00:00,2610,433,This has been talked about for decades but what if the American health care system was never tied to employment Would we be better off We need to blow up how America does health care,negative,0.6582542061805725
"This has been talked about for decades, but what if the American health care system was never tied to employment? Would we be better off? We need to blow up how America does health care.","{""""}",2020-09-03 23:18:01.081000+00:00,2020-09-03 23:18:02.272000+00:00,2610,434,This has been talked about for decades but what if the American health care system was never tied to employment Would we be better off We need to blow up how America does health care,negative,0.6582542061805725
"A 2% tax on households that have a net worth of more than $50 million is ridiculous in my opinion. I mean, if they earned it honestly and worked hard why should they be taxed more? Why not tax the politicians that suggest it? Plus, if they make the money through investments and stocks, they probably couldn't have known they'd make that much.","{money,taxes,government}",2020-09-03 23:19:04.870000+00:00,2020-09-03 23:19:08.236000+00:00,2663,435,A tax on households that have a net worth of more than million is ridiculous in my opinion I mean if they earned it honestly and worked hard why should they be taxed more Why not tax the politicians that suggest it Plus if they make the money through investments and stocks they probably couldnt have known theyd make that much,negative,0.7265025973320007
"A 2% tax on households that have a net worth of more than $50 million is ridiculous in my opinion. I mean, if they earned it honestly and worked hard why should they be taxed more? Why not tax the politicians that suggest it? Plus, if they make the money through investments and stocks, they probably couldn't have known they'd make that much.",{moneytaxesgovernment},2020-09-03 23:19:07.408000+00:00,2020-09-03 23:19:10.861000+00:00,2663,436,A tax on households that have a net worth of more than million is ridiculous in my opinion I mean if they earned it honestly and worked hard why should they be taxed more Why not tax the politicians that suggest it Plus if they make the money through investments and stocks they probably couldnt have known theyd make that much,negative,0.7265025973320007
How much do you really know what's in your food?  Microbial DNA?  DNA from complete other species?  There is much too that is unknown about the long term effects of GMOs.,{GMONoMutantFood},2020-09-03 23:19:29.334000+00:00,2020-09-03 23:19:31.489000+00:00,2667,437,How much do you really know whats in your food Microbial DNA DNA from complete other species There is much too that is unknown about the long term effects of GMOs,negative,0.9501825571060181
How much do you really know what's in your food?  Microbial DNA?  DNA from complete other species?  There is much too that is unknown about the long term effects of GMOs.,"{GMO,NoMutantFood}",2020-09-03 23:19:36.069000+00:00,2020-09-03 23:19:39.920000+00:00,2667,438,How much do you really know whats in your food Microbial DNA DNA from complete other species There is much too that is unknown about the long term effects of GMOs,negative,0.9501825571060181
Mutants are fun and cool in the XMen movies.  Not so much in your supper! No unsafe mutant food!,"{GMO,NoMutantFood}",2020-09-03 23:21:11.149000+00:00,2020-09-03 23:21:26.615000+00:00,2667,439,Mutants are fun and cool in the XMen movies Not so much in your supper No unsafe mutant food,negative,0.7668711543083191
The dog days of summer are just slowly becoming the dog days of the year. Don't let the government and it's lobbying turn our beautiful Earth into a scorching planet in the name of money!,"{money,government,environment}",2020-09-03 23:25:23.992000+00:00,2020-09-03 23:25:24+00:00,2663,440,The dog days of summer are just slowly becoming the dog days of the year Dont let the government and its lobbying turn our beautiful Earth into a scorching planet in the name of money,negative,0.7230733036994934
Donald Trump has been crippling the EPA since the beginning by appointing Scott Pruitt (a man who sued the EPA several times) to undo Obama era policies. We need those policies back ASAP or the environment may be permanently crippled.,"{saveourplanet,firetrump,environmentalism,trump}",2020-09-03 23:31:09.570000+00:00,2020-09-05 23:26:46.660000+00:00,2704,441,Donald Trump has been crippling the EPA since the beginning by appointing Scott Pruitt a man who sued the EPA several times to undo Obama era policies We need those policies back ASAP or the environment may be permanently crippled,negative,0.8925322890281677
Can't believe we're still debating nuclear energy in this day and age. America can do better than that unsafe energy source. More solar panels please.,"{""""}",2020-09-03 23:31:17.924000+00:00,2020-09-03 23:31:17.933000+00:00,2610,442,Cant believe were still debating nuclear energy in this day and age America can do better than that unsafe energy source More solar panels please,positive,0.5604470372200012
"Apparently a small nuclear plant was approved in the US today, thankfully it's in a very rural area in case something does go wrong, but what if the government wants to build one in say, San Diego? Washington D.C.? Atlanta? So many horrible things could go wrong.","{nuclearpower,power,nuclear}",2020-09-03 23:31:25.658000+00:00,2020-09-03 23:31:25.680000+00:00,2663,443,Apparently a small nuclear plant was approved in the US today thankfully its in a very rural area in case something does go wrong but what if the government wants to build one in say San Diego Washington DC Atlanta So many horrible things could go wrong,positive,0.5281768441200256
Why is America keeping our health care system intact that is obviously broken? Not hating on ObamaCare but the whole American system doesn't work for all.,"{""""}",2020-09-03 23:34:36.077000+00:00,2020-09-03 23:34:36.087000+00:00,2610,444,Why is America keeping our health care system intact that is obviously broken Not hating on ObamaCare but the whole American system doesnt work for all,positive,0.6057254076004028
Strongly disapprove on a two percent annual tax on households whose net worth is more than 50 million I feel like it's unfair ,"{""""}",2020-09-03 23:36:05.612000+00:00,2020-09-03 23:36:05.623000+00:00,2714,445,Strongly disapprove on a two percent annual tax on households whose net worth is more than million I feel like its unfair ,positive,0.6258617639541626
"Agreed, can't have economics if we don't have a planet!",,2020-09-03 23:57:31.746000+00:00,2020-09-03 23:57:35.023000+00:00,2663,446,Agreed cant have economics if we dont have a planet,positive,0.6773303151130676
"I think it's crazy some people want to tax people more, especially those who have $50 million in net worth, sure 2% isn't a lot in the long run, but it starts to add up. What if that 2% was going towards their kids?","{politics,taxes,money}",2020-09-04 00:09:18.707000+00:00,2020-09-04 00:09:23.815000+00:00,2663,447,I think its crazy some people want to tax people more especially those who have million in net worth sure isnt a lot in the long run but it starts to add up What if that was going towards their kids,negative,0.6168197989463806
OT... I love Ian on Big Brother.  I wonder if he does GMO's.,"{BB25,GMO}",2020-09-04 00:26:11.548000+00:00,2020-09-04 00:26:24.005000+00:00,2622,448,OT I love Ian on Big Brother I wonder if he does GMOs,positive,0.983164370059967
Many GMO crops harm the environment through the increased use of toxic herbicides and pesticides. ,"{""""}",2020-09-04 01:07:33.349000+00:00,2020-09-04 01:07:37.133000+00:00,2608,449,Many GMO crops harm the environment through the increased use of toxic herbicides and pesticides ,positive,0.763224720954895
