text,tags,createdAt,updatedAt,AuthorId,PostID,norm_text,labels,scores
"I think that we should move away from nuclear energy as an energy source,the harm that it does  to the environment is damaging and we have to go towards a less harmful energy source.","{nuclear,energy,enviroment}",2020-09-03 01:59:10.051000+00:00,2020-09-04 13:08:51.133000+00:00,2580,93,I think that we should move away from nuclear energy as an energy sourcethe harm that it does to the environment is damaging and we have to go towards a less harmful energy source,positive,0.6471296548843384
"Given the security put in place since 911, it is unlikely that the United States will experience a major terrorist attack that will kill more than 1000 American citizens. 

",{TerroristAttack},2020-09-03 02:28:29.002000+00:00,2020-09-04 13:08:51.133000+00:00,2593,94,Given the security put in place since it is unlikely that the United States will experience a major terrorist attack that will kill more than American citizens ,negative,0.7074823379516602
"It is crucial that the United States plays a role in world affairs moving forward. It is best for our country!
",{Worldaffairs},2020-09-03 02:34:07.312000+00:00,2020-09-04 13:08:51.133000+00:00,2593,96,It is crucial that the United States plays a role in world affairs moving forward It is best for our country ,positive,0.9770658612251282
"Strongly disapprove of a two percent annual tax on households whose net worth is more than 50 million. Bad idea!
",{WealthTax},2020-09-03 02:36:27.825000+00:00,2020-09-04 13:08:51.133000+00:00,2593,97,Strongly disapprove of a two percent annual tax on households whose net worth is more than million Bad idea ,positive,0.8549124002456665
"The U.S. government has gone too far in response to COVID. We should be free to decide what we want to do. If others are nervous, then they can wear a mask.","{COVID,pandemic}",2020-09-03 02:40:41.623000+00:00,2020-09-04 13:08:51.133000+00:00,2679,98,The US government has gone too far in response to COVID We should be free to decide what we want to do If others are nervous then they can wear a mask,negative,0.950480580329895
"Nature has been around forever, and has managed on its own this far. We really need to focus on efforts on economic growth, not environmental growth!",{economy},2020-09-03 02:43:58.138000+00:00,2020-09-03 02:43:58.148000+00:00,2679,99,Nature has been around forever and has managed on its own this far We really need to focus on efforts on economic growth not environmental growth,negative,0.5124884843826294
"Every time I hear the covid-19 death toll, I get so angry.  When is Trump going †o get his head out of the sand and come up with a viable national plan?  ",{covid},2020-09-03 02:44:55.598000+00:00,2020-09-04 13:08:51.133000+00:00,2622,100,Every time I hear the covid death toll I get so angry When is Trump going o get his head out of the sand and come up with a viable national plan ,negative,0.7336432933807373
People who make large amounts of money worked hard to get where they are today. It's not fair to tax them even more just because they managed to make more money.,{wealthtax},2020-09-03 02:45:21.607000+00:00,2020-09-03 02:45:21.615000+00:00,2679,101,People who make large amounts of money worked hard to get where they are today Its not fair to tax them even more just because they managed to make more money,negative,0.978429913520813
"Coronavirus is spreading in schools, but the federal government isn't keeping count https://www.nbcnews.com/news/us-news/coronavirus-spreading-schools-no-one-tracking-all-outbreaks-n1236964 via @nbcnews ","{Trump,covid}",2020-09-03 02:49:55.270000+00:00,2020-09-04 13:08:51.133000+00:00,2622,102,Coronavirus is spreading in schools but the federal government isnt keeping count via nbcnews ,negative,0.546085000038147
https://www.cnn.com/2019/02/17/opinions/wealth-tax-is-bad-idea-andelman/index.html,{wealthtax},2020-09-03 03:02:00.806000+00:00,2020-09-03 03:02:00.817000+00:00,2679,103,,positive,1.0000100135803223
"I think it's very likely that by the end of this year, the dow jones will end at least 20% lower than it was when it hit it's peak in February 2020.",{dowsgoindown},2020-09-03 03:02:16.366000+00:00,2020-09-04 13:08:51.133000+00:00,2657,104,I think its very likely that by the end of this year the dow jones will end at least lower than it was when it hit its peak in February ,negative,0.9586338996887207
"Economic growth needs to be given priority, even if the environment suffers to some extent.  Think about it people.  ",{growthisbest},2020-09-03 03:02:35.699000+00:00,2020-09-03 03:02:35.709000+00:00,2604,105,Economic growth needs to be given priority even if the environment suffers to some extent Think about it people ,negative,0.8690693974494934
Why should people have to use this healthcare system if they don't even believe it's working? I say medicare for all who want it is such a good idea. ,{medicareforallwhowantit},2020-09-03 03:08:38.540000+00:00,2020-09-04 13:08:51.133000+00:00,2657,106,Why should people have to use this healthcare system if they dont even believe its working I say medicare for all who want it is such a good idea ,negative,0.5054397583007812
Genetically modified foods are not necessarily safe:  Prove me wrong.,{freakyfoods},2020-09-03 03:10:33.910000+00:00,2020-09-04 13:08:51.133000+00:00,2604,107,Genetically modified foods are not necessarily safe Prove me wrong,negative,0.9578096866607666
Talk to me about how Covid has affect the Dow Jones.  I suspect will end the year at least 20%. What do you think?,"{""""}",2020-09-03 03:14:19.894000+00:00,2020-09-03 03:14:19.905000+00:00,2604,108,Talk to me about how Covid has affect the Dow Jones I suspect will end the year at least What do you think,positive,0.6985034346580505
The environment is suffering! We need to help it out! economic growth can wait a little while or learn to coexist but mother earth needs priority!,"{""""}",2020-09-03 03:17:41.065000+00:00,2020-09-04 13:08:51.133000+00:00,2657,109,The environment is suffering We need to help it out economic growth can wait a little while or learn to coexist but mother earth needs priority,negative,0.9696860313415527
What do we really know about the long term effects of genetically modified foods?  I don't want to be a test case.,{GMO},2020-09-03 03:19:34.607000+00:00,2020-09-04 13:08:51.133000+00:00,2622,110,What do we really know about the long term effects of genetically modified foods I dont want to be a test case,negative,0.8065192103385925
The United States needs to concentrate more on its own country and people and less on the world. We have so many issues here that need to be resolved!,{proudAmerican},2020-09-03 03:19:41.496000+00:00,2020-09-04 13:08:51.133000+00:00,2665,111,The United States needs to concentrate more on its own country and people and less on the world We have so many issues here that need to be resolved,negative,0.8894081711769104
"<h1> Harvard's campus will not open for fall semester for the 1st time in 384 years
If Harvard will be closed this is a sign other schools should also not open this fall. The pandemic still should be taken seriously.","{Harvard,closed,2020,fall}",2020-09-03 03:22:30.995000+00:00,2020-09-04 13:08:51.133000+00:00,2719,112,h Harvards campus will not open for fall semester for the st time in years If Harvard will be closed this is a sign other schools should also not open this fall The pandemic still should be taken seriously,negative,0.9435948729515076
"With all the focus on COVID is the US what is the likelihood that we will suffer a terrorist attack within our borders? Take a look at this.

https://www.rand.org/blog/2017/06/can-we-predict-where-terrorists-will-strike-next.html

","{terrorism,preparedness}",2020-09-03 03:53:10.074000+00:00,2020-09-03 03:53:10.088000+00:00,2618,113,With all the focus on COVID is the US what is the likelihood that we will suffer a terrorist attack within our borders Take a look at this ,negative,0.729306161403656
"Protection of the environment should be given priority even at the expense of economic growth. The planet is dying people!

https://www.sciencedirect.com/science/article/abs/pii/S1462901105000560","{saveourplanet,globalwarmingisreal}",2020-09-03 03:59:14.474000+00:00,2020-09-04 13:08:51.133000+00:00,2618,114,Protection of the environment should be given priority even at the expense of economic growth The planet is dying people ,negative,0.5458435416221619
"A 2% tax on multi-millionaires (whose net worth exceeds $50 million) would help us ordinary folk and extend social security.

https://www.cnbc.com/2020/07/30/more-worry-about-social-security-running-out-of-money-amid-covid-19.html",{taxesaregood},2020-09-03 04:04:28.107000+00:00,2020-09-04 13:08:51.133000+00:00,2618,115,A tax on multimillionaires whose net worth exceeds million would help us ordinary folk and extend social security ,positive,0.8997323513031006
"We need to protect ourselves. Sure the pandemic is awful and needs to be addressed, but lets not lose focus on terrorists that are still out to get us! We could very likely have another terrorist attack that kills over 1000 Americans.
#neverforget","{""""}",2020-09-03 04:26:14.937000+00:00,2020-09-03 04:26:14.949000+00:00,2665,116,We need to protect ourselves Sure the pandemic is awful and needs to be addressed but lets not lose focus on terrorists that are still out to get us We could very likely have another terrorist attack that kills over Americans neverforget,negative,0.9857003092765808
"American has seen itself as the policeman and saviour of the world for far too long.  We have enough problems of our own, we need to focus on them first for a while.


https://foreignpolicy.com/2020/07/13/anti-american-century-united-states-order/","{""""}",2020-09-03 05:53:41.910000+00:00,2020-09-03 05:53:42.052000+00:00,2540,117,American has seen itself as the policeman and saviour of the world for far too long We have enough problems of our own we need to focus on them first for a while ,negative,0.7096617817878723
Absolutely! The preservation of the environment is of utmost concern!,,2020-09-03 06:05:01.123000+00:00,2020-09-03 06:05:01.135000+00:00,2444,118,Absolutely The preservation of the environment is of utmost concern,positive,0.9893428087234497
"Of course! The economy can wait, destruction of the environment will make the economic issues moot!",,2020-09-03 06:08:59.136000+00:00,2020-09-03 06:08:59.147000+00:00,2444,119,Of course The economy can wait destruction of the environment will make the economic issues moot,negative,0.7727603912353516
"So, I don't know about you, but I'm about done with this mask mandate.  Gonna keep on though, cuz I don't want anyone in my family getting this bug, or spreading it.

Government hasn't really done enough to stop covid, imo. ",{covid},2020-09-03 06:14:12.939000+00:00,2020-09-04 13:08:51.133000+00:00,2542,120,So I dont know about you but Im about done with this mask mandate Gonna keep on though cuz I dont want anyone in my family getting this bug or spreading it Government hasnt really done enough to stop covid imo ,positive,0.605248212814331
"Trump: ""America First!"" Yet he sends PPE & Ventilators To China. At Home Calls Covid-19 a Democratic Hoax   I guess it's more like America Last!

https://www.youtube.com/embed/sFOJ2dIzQIM",{CovidTrump},2020-09-03 08:12:17.939000+00:00,2020-09-03 08:12:17.952000+00:00,2622,121,Trump America First Yet he sends PPE Ventilators To China At Home Calls Covid a Democratic Hoax I guess its more like America Last ,negative,0.9112804532051086
Am I the only one terrified of the unknown danger that GMO's could be posing to the people that consume them?,"{""""}",2020-09-03 08:26:01.216000+00:00,2020-09-03 08:26:01.230000+00:00,2443,122,Am I the only one terrified of the unknown danger that GMOs could be posing to the people that consume them,negative,0.9381633996963501
We can't really say that GMO's are safe when there are no long-term human studies available.  There was a study done on mice which linked GMO intake to a higher risk of tumors and early death.  ,{gmo},2020-09-03 08:30:06.403000+00:00,2020-09-04 13:08:51.133000+00:00,2622,123,We cant really say that GMOs are safe when there are no longterm human studies available There was a study done on mice which linked GMO intake to a higher risk of tumors and early death ,negative,0.7013654112815857
GMO foods contain foreign genes and can trigger allergies.  Just say No.,{gmo},2020-09-03 08:33:32.101000+00:00,2020-09-03 08:33:32.124000+00:00,2622,124,GMO foods contain foreign genes and can trigger allergies Just say No,positive,0.9157916307449341
 I do not think the Dow Jones will end the year 2020 down at least 20% mostly due to what is  happening to the economy,"{economy,covid}",2020-09-03 10:20:05.530000+00:00,2020-09-03 10:20:05.540000+00:00,2580,125, I do not think the Dow Jones will end the year down at least mostly due to what is happening to the economy,negative,0.7708735466003418
markdown rules!,"{""""}",2020-09-03 10:35:21.581000+00:00,2020-09-03 10:35:21.589000+00:00,2600,126,markdown rules,negative,0.9969143271446228
Have you guys seen the out of control college parties and mass gatherings people are having? The government needs to do a better job of making sure that people follow the rules they set into place for the safety of everyone!,{coronaviruscovid19},2020-09-03 10:40:32.996000+00:00,2020-09-04 13:08:51.133000+00:00,2702,127,Have you guys seen the out of control college parties and mass gatherings people are having The government needs to do a better job of making sure that people follow the rules they set into place for the safety of everyone,negative,0.934637725353241
We really need to start focusing on protecting the world we live in before we worry about the economy.  Too many animals are becoming extinct or having their habitats destroyed by us.,"{hugatree,loveyourearth,environment}",2020-09-03 10:41:26.436000+00:00,2020-09-04 13:08:51.133000+00:00,2700,128,We really need to start focusing on protecting the world we live in before we worry about the economy Too many animals are becoming extinct or having their habitats destroyed by us,negative,0.6310106515884399
Just imagine how much money we could collect if the ultra wealthy making over 50 mill would each be taxed 2 percent? That mass amount would do so much good for society!,{taxthewealthy},2020-09-03 10:43:08.252000+00:00,2020-09-04 13:08:51.133000+00:00,2700,129,Just imagine how much money we could collect if the ultra wealthy making over mill would each be taxed percent That mass amount would do so much good for society,negative,0.846912682056427
I am not very hopeful for the Dow Jones.  I have a feeling that it will end the year 20% below its peak in February 2020.,"{covid,economicdownturn}",2020-09-03 10:44:05.062000+00:00,2020-09-03 10:44:05.076000+00:00,2700,130,I am not very hopeful for the Dow Jones I have a feeling that it will end the year below its peak in February ,negative,0.7580852508544922
Poll: Majority of Americans say that federal government not doing enough to prevent second wave of virus. What are your thoughts?,"{COVID,secondwave}",2020-09-03 10:57:54.124000+00:00,2020-09-04 13:08:51.133000+00:00,2750,131,Poll Majority of Americans say that federal government not doing enough to prevent second wave of virus What are your thoughts,negative,0.7843849062919617
"We need a green America! Lets transition from Nuclear power! Think solar power, wind power, geothermal power!","{""""}",2020-09-03 11:24:44.821000+00:00,2020-09-03 11:24:44.831000+00:00,2558,132,We need a green America Lets transition from Nuclear power Think solar power wind power geothermal power,positive,0.9857310056686401
"Deep-seated racism, pollution, gun violence, political divide, unemployment... Just a few of the issues facing us here in America. Let's not turn our backs on the world, but let's take a moment to try and fix what needs fixing in this country of ours!","{""""}",2020-09-03 11:26:42.747000+00:00,2020-09-04 13:08:51.133000+00:00,2665,133,Deepseated racism pollution gun violence political divide unemployment Just a few of the issues facing us here in America Lets not turn our backs on the world but lets take a moment to try and fix what needs fixing in this country of ours,negative,0.9662973284721375
"For now we should focus on our country but when we have new leadership step into office, we need to repair the damage and begin a different course for American foreign policy for the world. Set a new example. ","{""""}",2020-09-03 11:30:04.613000+00:00,2020-09-03 11:30:06.174000+00:00,2750,134,For now we should focus on our country but when we have new leadership step into office we need to repair the damage and begin a different course for American foreign policy for the world Set a new example ,positive,0.7112892270088196
The United States will NOT have a terrorist attack that harms/kills more than 1000 civilians. I am confident that our government will keep us safe from this kind of threat!,{Terrorism},2020-09-03 11:32:00.276000+00:00,2020-09-03 11:32:00.287000+00:00,2687,135,The United States will NOT have a terrorist attack that harmskills more than civilians I am confident that our government will keep us safe from this kind of threat,positive,0.6131278872489929
We cannot keep the current healthcare system as is. Allowing people to opt into medicare puts a strain on the healthcare system which is already BROKEN. We need universal healthcare or a complete reform so peoples’ health is not dependent on their job!!,"{healthcare,health,universalhealthcare}",2020-09-03 11:35:38.190000+00:00,2020-09-03 11:35:38.199000+00:00,2687,136,We cannot keep the current healthcare system as is Allowing people to opt into medicare puts a strain on the healthcare system which is already BROKEN We need universal healthcare or a complete reform so peoples health is not dependent on their job,negative,0.6666070818901062
 We need to protect America and American jobs. Focus on America!,"{""""}",2020-09-03 11:40:45.900000+00:00,2020-09-03 11:40:45.909000+00:00,2558,137, We need to protect America and American jobs Focus on America,negative,0.5000998377799988
" The wealthiest individuals should pay higher taxes, pro 2% on net worth over 50 M","{""""}",2020-09-03 11:44:04.382000+00:00,2020-09-03 11:44:04.390000+00:00,2558,138, The wealthiest individuals should pay higher taxes pro on net worth over M,positive,0.6891821622848511
"Medicare for all, or socialized medicine, would put a strain on our at already risked  system, lead to fewer healthcare choices for Americans and ultimately the bill being footed by higher taxes and higher private premiums. ","{socializedhealthcare,medicareforall}",2020-09-03 11:54:31.367000+00:00,2020-09-03 11:54:31.378000+00:00,2649,139,Medicare for all or socialized medicine would put a strain on our at already risked system lead to fewer healthcare choices for Americans and ultimately the bill being footed by higher taxes and higher private premiums ,negative,0.6806771159172058
"Good morning, everybody!  Make it a great day!",{positivity},2020-09-03 12:03:36.258000+00:00,2020-09-03 12:03:36.266000+00:00,2481,140,Good morning everybody Make it a great day,positive,0.6486470699310303
Nuclear wastes can remain radioactive for thousands of years!,"{""""}",2020-09-03 12:05:28.142000+00:00,2020-09-03 12:05:28.152000+00:00,2558,141,Nuclear wastes can remain radioactive for thousands of years,negative,0.9833013415336609
Pandemic government actions overreaction to political pressure. What has the closures of American businesses accomplished besides putting many hardworking individuals out of work and closing down American dreams. ,{fightforamericaopentheeconomypandemicoverkill},2020-09-03 12:07:59.376000+00:00,2020-09-03 12:08:00.748000+00:00,2649,142,Pandemic government actions overreaction to political pressure What has the closures of American businesses accomplished besides putting many hardworking individuals out of work and closing down American dreams ,positive,0.7617501616477966
https://www.google.com/amp/s/www.cnbc.com/amp/2020/09/02/dr-fauci-says-us-coronavirus-cases-are-unacceptably-high-going-into-labor-day.html,"{""""}",2020-09-03 12:08:05.494000+00:00,2020-09-03 12:08:05.980000+00:00,2711,143,,positive,1.0000100135803223
Wind turbines can produce electricity for less then 5 cents per kWh vs nuclear at 12 to 17 cents per kWh,"{""""}",2020-09-03 12:08:20.459000+00:00,2020-09-03 12:08:20.468000+00:00,2558,144,Wind turbines can produce electricity for less then cents per kWh vs nuclear at to cents per kWh,negative,0.895049512386322
Wake up people...the market will eventually catch up to the world unrest  and the dow will plummet by at least  20%. A recession is imminent. ,"{recession,dowdecline}",2020-09-03 12:11:48.107000+00:00,2020-09-03 12:11:48.115000+00:00,2649,145,Wake up peoplethe market will eventually catch up to the world unrest and the dow will plummet by at least A recession is imminent ,negative,0.7087411284446716
"Make sure you guys stay safe, social distance from each other and santize whereever you go. If our lazy government won't close businesses down for labor day, you could at least help out others and continue to slow the spread of Covid 19.",{Staysafe},2020-09-03 12:16:04.963000+00:00,2020-09-03 12:16:04.975000+00:00,2711,146,Make sure you guys stay safe social distance from each other and santize whereever you go If our lazy government wont close businesses down for labor day you could at least help out others and continue to slow the spread of Covid ,negative,0.6735871434211731
"2 pennies out of every dollar! It's such a small amount, but all the good it would do!",,2020-09-03 12:24:48.395000+00:00,2020-09-03 12:24:48.404000+00:00,2481,147, pennies out of every dollar Its such a small amount but all the good it would do,negative,0.5118408203125
"Nobody wants to be the bearer of bad news, but it looks like the DowJones is definitely headed down. Back when we thought the worst of the pandemic would be over by mid-summer, it was easier to be optimistic. ","{dowjones,dowjonesgoingDOWn}",2020-09-03 12:26:35.184000+00:00,2020-09-03 12:26:35.194000+00:00,2545,148,Nobody wants to be the bearer of bad news but it looks like the DowJones is definitely headed down Back when we thought the worst of the pandemic would be over by midsummer it was easier to be optimistic ,negative,0.8185566067695618
"The U.S. government has over-reached on the coronavirus response in some ways. Even though it didn't bother with any contact tracing, it took too strong an approach to closing down businesses. There are still businesses down in my area.",{toostrong},2020-09-03 12:32:41.581000+00:00,2020-09-03 12:32:43.024000+00:00,2596,149,The US government has overreached on the coronavirus response in some ways Even though it didnt bother with any contact tracing it took too strong an approach to closing down businesses There are still businesses down in my area,negative,0.8775166273117065
A friend of mine just got hit with a $12K hospital bill for her COVID treatment! Unbelievable! We NEED socialized medicine in this country!,"{healthcare,covid}",2020-09-03 12:35:20.368000+00:00,2020-09-04 13:08:51.133000+00:00,2627,150,A friend of mine just got hit with a K hospital bill for her COVID treatment Unbelievable We NEED socialized medicine in this country,positive,0.6397095918655396
When will our businesses be back open? And when will we be able to get back to work? I think the coronavirus response is too strong in this area. We need to think about this more carefully.,"{""""}",2020-09-03 12:36:55.516000+00:00,2020-09-03 12:36:56.614000+00:00,2596,151,When will our businesses be back open And when will we be able to get back to work I think the coronavirus response is too strong in this area We need to think about this more carefully,negative,0.6570970416069031
Why do people need more than $50 million in net worth? We have a huge budget crisis out there. We need to start taxing some people to fix it! A 2% tax isn't too much to pay.,"{""""}",2020-09-03 12:37:45.018000+00:00,2020-09-03 12:37:45.026000+00:00,2596,152,Why do people need more than million in net worth We have a huge budget crisis out there We need to start taxing some people to fix it A tax isnt too much to pay,negative,0.864361047744751
Taxing real estate is an especially good idea. This is a part of the economy where people make money through grifting and speculation. Putting a reasonable tax on that amount is just a great idea!,"{""""}",2020-09-03 12:39:05.336000+00:00,2020-09-03 12:39:05.353000+00:00,2596,153,Taxing real estate is an especially good idea This is a part of the economy where people make money through grifting and speculation Putting a reasonable tax on that amount is just a great idea,positive,0.6276307702064514
"We desperately need a way to keep funding all these programs and responses. And a reasonable tax of two percent on wealth could do that! I don't see any good reason not to do it. People can afford it, and we need the money.","{""""}",2020-09-03 12:41:53.039000+00:00,2020-09-03 12:41:55.124000+00:00,2596,154,We desperately need a way to keep funding all these programs and responses And a reasonable tax of two percent on wealth could do that I dont see any good reason not to do it People can afford it and we need the money,negative,0.6051256656646729
"I know the Dow Jones went down by a lot earlier this year. But, look, it's back up now. I don't see much way it ends up 20% or more below where it was earlier. We've come a long way in our recovery.","{""""}",2020-09-03 12:42:57.041000+00:00,2020-09-04 13:08:51.133000+00:00,2596,155,I know the Dow Jones went down by a lot earlier this year But look its back up now I dont see much way it ends up or more below where it was earlier Weve come a long way in our recovery,negative,0.915482223033905
