text,tags,createdAt,updatedAt,AuthorId,PostID,norm_text,labels,scores
"""Law and Order"" means nothing if national leadership puts law enforcement in harm's way.",,2020-09-05 00:13:00.129000+00:00,2020-09-07 12:44:04.490000+00:00,2610,658,Law and Order means nothing if national leadership puts law enforcement in harms way,positive,0.9285554885864258
"Agreed, its sad to think that our future generations may not be able to play outdoors because of pollution. ",,2020-09-05 00:16:39.391000+00:00,2020-09-05 00:16:39.398000+00:00,2663,659,Agreed its sad to think that our future generations may not be able to play outdoors because of pollution ,negative,0.9449692368507385
"Happy Labor Day weekend everyone! Go outside and enjoy the great outdoors while we have it. Don't forget to protect nature and enjoy it! Be sure to tell your local politicians to stop putting money before the earth, save the green grass instead of the green bills!","{money,economics,environment}",2020-09-05 00:17:56.964000+00:00,2020-09-07 12:44:04.490000+00:00,2663,660,Happy Labor Day weekend everyone Go outside and enjoy the great outdoors while we have it Dont forget to protect nature and enjoy it Be sure to tell your local politicians to stop putting money before the earth save the green grass instead of the green bills,negative,0.8418129086494446
"People need to realize what the Trump Admin is doing, while they lie about the opposite.",,2020-09-05 00:26:47.455000+00:00,2020-09-05 00:26:47.463000+00:00,2610,661,People need to realize what the Trump Admin is doing while they lie about the opposite,negative,0.6153292655944824
"47% of American think the US should mind it's own business!!!
https://www.nbcnews.com/politics/first-read/47-say-u-s-should-reduce-role-world-affairs-n92871",{UsAffairs},2020-09-05 00:47:55.496000+00:00,2020-09-05 00:47:55.504000+00:00,2566,662, of American think the US should mind its own business ,negative,0.556480884552002
Medicare should be available for any adult so everyone has access to affordable healthcare.,{MedicareForAll},2020-09-05 00:49:31.815000+00:00,2020-09-05 00:49:31.824000+00:00,2718,663,Medicare should be available for any adult so everyone has access to affordable healthcare,positive,0.7567845582962036
Masks? Closures? Social distancing? The United States government has been too strong with the coronavirus response. We need to lay off the restrictions and return to normal.,{TooStrong},2020-09-05 00:51:01.283000+00:00,2020-09-05 00:51:01.292000+00:00,2718,664,Masks Closures Social distancing The United States government has been too strong with the coronavirus response We need to lay off the restrictions and return to normal,negative,0.7366522550582886
"Imagine if wealth was redistrubuted and it was easier to climb your way out of poverty? A 2% tax on the wealthy would allow for increased funding of programs to help lower income secure affordable housing, medical care, and the tools and skills to become employable with a living wage. ","{RedistributeTheWealth,TaxThe2}",2020-09-05 00:52:53.145000+00:00,2020-09-05 00:52:53.155000+00:00,2718,665,Imagine if wealth was redistrubuted and it was easier to climb your way out of poverty A tax on the wealthy would allow for increased funding of programs to help lower income secure affordable housing medical care and the tools and skills to become employable with a living wage ,negative,0.9101206660270691
Lets get rid of medicare completely!!!,{MedicareScam},2020-09-05 00:55:11.257000+00:00,2020-09-05 00:55:11.267000+00:00,2565,666,Lets get rid of medicare completely,negative,0.6662719249725342
Why is the government even involved?,{MedicareScam},2020-09-05 01:00:00.836000+00:00,2020-09-05 01:00:00.844000+00:00,2565,667,Why is the government even involved,negative,0.847907543182373
"When life gives you lemon you make lemonade, but when government gives you medicine you make medicaid. ",{MedicareScam},2020-09-05 01:03:01.226000+00:00,2020-09-05 01:03:01.235000+00:00,2565,668,When life gives you lemon you make lemonade but when government gives you medicine you make medicaid ,positive,0.9813521504402161
"Wear your masks in California, unless your name is Nancy!
https://www.bbc.com/news/world-us-canada-53994209",{NancyNoMask},2020-09-05 01:04:38.290000+00:00,2020-09-05 01:04:38.302000+00:00,2565,669,Wear your masks in California unless your name is Nancy ,negative,0.9868950843811035
Doctors need to stop accepting medicare!,{MedicareScam},2020-09-05 01:05:35.508000+00:00,2020-09-05 01:05:35.516000+00:00,2565,670,Doctors need to stop accepting medicare,positive,0.8459574580192566
"In June 2019, the top 10% hold almost 70% of the total wealth of the United States. The bottom 50% hold only about 2% of the nation's wealth. With the current system, the wealthier continue to get wealthier and the mid to lower class will continue to struggle as the gap widens. Taxing households with a net worth of 50 million dollars will provide more money for services to assist lower income to help work their way up and better distribute the wealth within the mid to lower classes..",{TaxThe2},2020-09-05 01:06:10.941000+00:00,2020-09-05 01:06:10.949000+00:00,2718,671,In June the top hold almost of the total wealth of the United States The bottom hold only about of the nations wealth With the current system the wealthier continue to get wealthier and the mid to lower class will continue to struggle as the gap widens Taxing households with a net worth of million dollars will provide more money for services to assist lower income to help work their way up and better distribute the wealth within the mid to lower classes,negative,0.6990304589271545
"Healthcare is a right, not a luxury. Medicare for all needs to be implemented to ensure all people have access to affordable healthcare.",{MedicareForAll},2020-09-05 01:06:49.932000+00:00,2020-09-05 01:06:49.940000+00:00,2718,672,Healthcare is a right not a luxury Medicare for all needs to be implemented to ensure all people have access to affordable healthcare,negative,0.7733584642410278
"Sweden has a lower death rate from Covid than the US.  Kids are going to school.  There is no social distancing, no closures.  hmmmm.  WHAT IS GOING ON??",{COVID},2020-09-05 01:07:04.725000+00:00,2020-09-05 01:07:04.734000+00:00,2565,673,Sweden has a lower death rate from Covid than the US Kids are going to school There is no social distancing no closures hmmmm WHAT IS GOING ON,negative,0.9885991811752319
"Health care is a right. Health care must be affordable. Medicare for all needs to be implemented, and whoever wishes to keep their plan can. ",{MedicareForAll},2020-09-05 01:08:44.342000+00:00,2020-09-05 01:08:44.350000+00:00,2718,674,Health care is a right Health care must be affordable Medicare for all needs to be implemented and whoever wishes to keep their plan can ,positive,0.7875226140022278
"Covid death count
Covid death by sex.  Covid death by age.  Scary stuff.  OH! I get it.  Covid death counts filtered by sex and age.",{Covid},2020-09-05 01:09:30.799000+00:00,2020-09-05 01:09:30.806000+00:00,2565,675,Covid death count Covid death by sex Covid death by age Scary stuff OH I get it Covid death counts filtered by sex and age,negative,0.9764379858970642
This pandemic is not as bad as it seems. The government has put in too many restrictions making the actions too strong. Let's roll back and get back into normal life. We all need a break from this pressure.,"{TooStrong,RollbackRestrictions}",2020-09-05 01:10:38.203000+00:00,2020-09-05 01:10:38.212000+00:00,2718,676,This pandemic is not as bad as it seems The government has put in too many restrictions making the actions too strong Lets roll back and get back into normal life We all need a break from this pressure,negative,0.9833143949508667
The 2% needs to be taxed. Let's redistribute the wealth and have them pay their fair share.,{TaxThe2},2020-09-05 01:11:28.584000+00:00,2020-09-05 01:11:28.592000+00:00,2718,677,The needs to be taxed Lets redistribute the wealth and have them pay their fair share,negative,0.8931090831756592
"Do hospitals have an incentive to inflate covid numbers?  Even the liberal C-Span thinks so
https://www.c-span.org/video/?c4897385/user-clip-cdc-director-acknowledges-inflation-covid-19-death-count","{Covid,MedicareScam}",2020-09-05 01:12:04.918000+00:00,2020-09-05 01:12:04.927000+00:00,2565,678,Do hospitals have an incentive to inflate covid numbers Even the liberal CSpan thinks so ,negative,0.9578782916069031
The US has been too strong in covid restrictions. It is time to ease up.,{TooStrong},2020-09-05 01:12:25.397000+00:00,2020-09-05 01:12:25.404000+00:00,2718,679,The US has been too strong in covid restrictions It is time to ease up,negative,0.7505724430084229
This says it all. #MedicareScam,{MedicareScam},2020-09-05 01:13:33.128000+00:00,2020-09-05 01:13:33.140000+00:00,2565,680,This says it all MedicareScam,negative,0.9949272871017456
"Too many people have went into debt because of medical bills. Want to keep your insurance? Fine, but let's create medicare for all to allow everyone to afford medical bills.",{MedicareForAll},2020-09-05 01:14:31.473000+00:00,2020-09-05 01:14:31.482000+00:00,2718,681,Too many people have went into debt because of medical bills Want to keep your insurance Fine but lets create medicare for all to allow everyone to afford medical bills,negative,0.5601654052734375
Medicare for all unless you are a politician,{medicareScam},2020-09-05 01:14:50.082000+00:00,2020-09-05 01:14:50.093000+00:00,2565,682,Medicare for all unless you are a politician,negative,0.9654226899147034
"bringourtroopshome.us
Why are we fighting these wars?",{BringTroopsHome},2020-09-05 01:17:18.679000+00:00,2020-09-05 01:17:18.689000+00:00,2566,683,bringourtroopshomeus Why are we fighting these wars,positive,0.9625259041786194
www.bringourtroopshome.us,{BringTroopsHome},2020-09-05 01:18:01.474000+00:00,2020-09-05 01:18:01.484000+00:00,2566,684,wwwbringourtroopshomeus,positive,0.9652526378631592
Rome also fought battles all over.  Whatever happened to them?,"{World,politics,war}",2020-09-05 01:20:57.705000+00:00,2020-09-05 01:20:57.715000+00:00,2566,685,Rome also fought battles all over Whatever happened to them,negative,0.9909002184867859
Seems a lot of us are on the GMO's aren't particularly healthy bandwagon!  Glad to see it.,{realfood},2020-09-05 01:22:33.139000+00:00,2020-09-07 12:44:04.490000+00:00,2604,686,Seems a lot of us are on the GMOs arent particularly healthy bandwagon Glad to see it,negative,0.5671510696411133
"People might complain, but at least he is trying to bring troops home","{Trump2020,World,Politics}",2020-09-05 01:22:59.077000+00:00,2020-09-05 01:22:59.086000+00:00,2566,687,People might complain but at least he is trying to bring troops home,negative,0.8323324918746948
What time is it?,{Cake},2020-09-05 01:24:25.559000+00:00,2020-09-05 01:24:25.569000+00:00,2566,688,What time is it,positive,0.9826034903526306
this image makes me hungry,{food},2020-09-05 01:25:52.177000+00:00,2020-09-05 01:25:52.188000+00:00,2566,689,this image makes me hungry,positive,0.9732535481452942
Time to party.  TGIF!,"{Party,world}",2020-09-05 01:28:02.903000+00:00,2020-09-05 01:28:02.912000+00:00,2566,690,Time to party TGIF,negative,0.9503187537193298
"The Dow will go down.  Are you prepared for the fall out?  What, if anything, are you doing to prepare?",{stockmarketcrash},2020-09-05 01:33:15.793000+00:00,2020-09-05 01:33:15.803000+00:00,2604,691,The Dow will go down Are you prepared for the fall out What if anything are you doing to prepare,negative,0.8092132806777954
"For those of you who want nuclear energy, watch an episode of the Simpsons.  These people exist everywhere.",{NoToNuclear},2020-09-05 01:36:24.066000+00:00,2020-09-05 01:36:24.074000+00:00,2564,692,For those of you who want nuclear energy watch an episode of the Simpsons These people exist everywhere,negative,0.5475716590881348
Anyone have any good articles to share about GMO foods?,"{""""}",2020-09-05 01:38:14.951000+00:00,2020-09-06 12:34:17.151000+00:00,2604,693,Anyone have any good articles to share about GMO foods,positive,0.8198162317276001
"In 2020 only 55% of Americans own stocks, and the only group that has maintained stock ownership over the years are old people or people making over $100,000 a year. Why do we pretend the stock market has anything to do with the economy? It's just rich people playing a game. We need to focus on people that don't benefit from the stock market going up.

https://news.gallup.com/poll/211052/stock-ownership-down-among-older-higher-income.aspx","{stocks,stockmarket}",2020-09-05 01:39:32.548000+00:00,2020-09-05 01:39:32.558000+00:00,2454,694,In only of Americans own stocks and the only group that has maintained stock ownership over the years are old people or people making over a year Why do we pretend the stock market has anything to do with the economy Its just rich people playing a game We need to focus on people that dont benefit from the stock market going up ,negative,0.7669070363044739
Nuclear is safe.  Just as Bob.,"{""""}",2020-09-05 01:41:01.983000+00:00,2020-09-05 01:41:01.992000+00:00,2564,695,Nuclear is safe Just as Bob,positive,0.911021888256073
"Really curious if there is anyone in the military on here right now that is concerned about America's place in the world at the moment.

","{Trump,LosersAndSuckers}",2020-09-05 01:41:27.218000+00:00,2020-09-05 01:41:27.227000+00:00,2610,696,Really curious if there is anyone in the military on here right now that is concerned about Americas place in the world at the moment ,negative,0.6659435629844666
"Get to know your GMO seeds
[More information on GMOs](https://gmoanswers.com/)","{""""}",2020-09-05 01:47:34.119000+00:00,2020-09-07 12:44:04.490000+00:00,2658,697,Get to know your GMO seeds More information on GMOs,positive,0.5265326499938965
"This is why it's important for the United States to be active in world affairs. We can't beat COVID19 by ourselves. It takes a unified global effort.

https://www.cfr.org/backgrounder/what-world-doing-create-covid-19-vaccine","{COVID19,COVID,Trump}",2020-09-05 01:49:25.689000+00:00,2020-09-05 01:49:25.708000+00:00,2610,698,This is why its important for the United States to be active in world affairs We cant beat COVID by ourselves It takes a unified global effort ,positive,0.6415543556213379
This is a nice rational thought about the world we live in. Agree with your sentiments.,,2020-09-05 01:54:32.029000+00:00,2020-09-05 01:54:32.037000+00:00,2610,699,This is a nice rational thought about the world we live in Agree with your sentiments,positive,0.9989724159240723
"Why do people put money before lives, debts about the well-being of Americans? We need to change this!",,2020-09-05 01:58:31.901000+00:00,2020-09-05 01:58:31.910000+00:00,2610,700,Why do people put money before lives debts about the wellbeing of Americans We need to change this,positive,0.5674673914909363
"With so many people losing power due to the hurricane, who thought it would be a good idea to even suggest using nuclear energy for electricity? What if a hurricane struck one? How safe are they for people to be near or even use?","{nuclearpower,power,energy,nuclear,nuclearenergy}",2020-09-05 02:05:18.654000+00:00,2020-09-07 12:44:04.490000+00:00,2663,701,With so many people losing power due to the hurricane who thought it would be a good idea to even suggest using nuclear energy for electricity What if a hurricane struck one How safe are they for people to be near or even use,negative,0.6434882879257202
"We need to be more active in the world,  but with better leadership. We are failing on all fronts now and Americans are paying for it.",,2020-09-05 02:07:44.373000+00:00,2020-09-05 02:07:44.385000+00:00,2610,702,We need to be more active in the world but with better leadership We are failing on all fronts now and Americans are paying for it,negative,0.8236386179924011
Investing in cleaner energy is the way to go!,,2020-09-05 02:12:38.109000+00:00,2020-09-05 02:12:38.118000+00:00,2610,703,Investing in cleaner energy is the way to go,positive,0.9211125373840332
"How long will it take for the stock market to recover?

The U.S. and most other stock markets have regained almost all of the ground lost during the stock market crash of spring 2020.

https://www.dailyforex.com/forex-articles/2020/04/is-the-stock-market-crash-of-2020-over/136355","{dontbeaDebbieDOWner,DOWRecovery2020}",2020-09-05 02:17:01.849000+00:00,2020-09-05 02:17:01.861000+00:00,2655,704,How long will it take for the stock market to recover The US and most other stock markets have regained almost all of the ground lost during the stock market crash of spring ,negative,0.9658949375152588
"How America treated the COVID19 pandemic reflects not just how America has lost its place in the world, but how our system, especially health care, failed us. Curious what everyone else thinks.",{COVID19},2020-09-05 02:22:11.598000+00:00,2020-09-05 02:22:11.612000+00:00,2610,705,How America treated the COVID pandemic reflects not just how America has lost its place in the world but how our system especially health care failed us Curious what everyone else thinks,negative,0.822809100151062
"I bought stocks this year for the first time. People were saying they would bounce right back up, and they sure did! I bought Apple and Johnson and Johnson because I had their products on my desk, hehe. Not a professional investor obviously.

Now I'm not sure what to do. I don't have a lot to lose but I'm afraid the market isn't going to stay high much longer. Is anybody in stocks? What do you think??","{stocks,stock,invest}",2020-09-05 02:26:42.579000+00:00,2020-09-05 02:26:42.589000+00:00,2457,706,I bought stocks this year for the first time People were saying they would bounce right back up and they sure did I bought Apple and Johnson and Johnson because I had their products on my desk hehe Not a professional investor obviously Now Im not sure what to do I dont have a lot to lose but Im afraid the market isnt going to stay high much longer Is anybody in stocks What do you think,negative,0.7962353229522705
"I heard the CDC thinks a vaccine is probably not going to be available for everyone until well into next year. Do you think it will work? Will people actually take it? What if we don't come up with one that works?

I don't think the economy will be able to fully recover without a vaccine!!","{economy,stocks,vaccine,covid}",2020-09-05 02:38:59.230000+00:00,2020-09-05 02:38:59.241000+00:00,2457,707,I heard the CDC thinks a vaccine is probably not going to be available for everyone until well into next year Do you think it will work Will people actually take it What if we dont come up with one that works I dont think the economy will be able to fully recover without a vaccine,positive,0.6231130361557007
https://www.wsj.com/articles/the-false-promise-of-medicare-for-all-1542066511,{medicare},2020-09-05 03:02:10.621000+00:00,2020-09-07 12:44:04.490000+00:00,2702,708,,positive,1.0000100135803223
"Data shows that some countries are still spiking in COVID cases, for instance India:
https://coronavirus.jhu.edu/data/new-cases
Even if we keep it under control in the USA it might affect our economy indirectly because the world is so interconnected. This isn't over by a long shot.","{covid,coronavirus,economy}",2020-09-05 03:11:54.543000+00:00,2020-09-05 03:11:54.553000+00:00,2454,709,Data shows that some countries are still spiking in COVID cases for instance India Even if we keep it under control in the USA it might affect our economy indirectly because the world is so interconnected This isnt over by a long shot,negative,0.529582679271698
"COVID-19 is not helping the environment. We have to make saving the planet a higher priority!

https://www.wbur.org/hereandnow/2020/06/18/covid-19-environment-climate-change","{savemotherearth,climatechange}",2020-09-05 03:43:15.378000+00:00,2020-09-05 03:43:15.390000+00:00,2618,710,COVID is not helping the environment We have to make saving the planet a higher priority ,positive,0.7073695659637451
"We have to be more vigilant! Terrorists may be planning attacks as we speak.

https://www.politico.com/news/2020/03/27/coronavirus-terrorism-justice-department-150870",{vigilance},2020-09-05 03:44:56.387000+00:00,2020-09-07 12:44:04.490000+00:00,2618,711,We have to be more vigilant Terrorists may be planning attacks as we speak ,negative,0.9828044176101685
"So glad that things are opening up again. And honestly, if there is another COVID surge, deal with it...but don't even think about another mass quarantine. We can't afford it. It's crippling us and it's a violation of our rights. The Federal Government has been too aggressive in their actions. ",{CoVIDIOTS},2020-09-05 03:49:04.349000+00:00,2020-09-05 03:49:04.359000+00:00,2655,712,So glad that things are opening up again And honestly if there is another COVID surge deal with itbut dont even think about another mass quarantine We cant afford it Its crippling us and its a violation of our rights The Federal Government has been too aggressive in their actions ,negative,0.736728847026825
The wealthy and rich earned their fortune that they've built their whole lives. Why should they be taxed more? I'm a firm believer of equal taxation for all.,"{equaltax,america}",2020-09-05 05:46:39.334000+00:00,2020-09-07 12:44:04.490000+00:00,2575,713,The wealthy and rich earned their fortune that theyve built their whole lives Why should they be taxed more Im a firm believer of equal taxation for all,negative,0.7256364822387695
Happy 18th birthday! You will be celebrating this day in line for 6+ hours at the crack of dawn with 100s of teenagers who have never heard of social distancing. Acceptable? I think not.,"{""""}",2020-09-05 06:11:44.134000+00:00,2020-09-07 12:44:04.490000+00:00,2702,714,Happy th birthday You will be celebrating this day in line for hours at the crack of dawn with s of teenagers who have never heard of social distancing Acceptable I think not,negative,0.8372179269790649
We should protect our nature better in order to continue to have a life worth living in the future. ,"{Health,environment,protect}",2020-09-05 07:24:48.519000+00:00,2020-09-07 12:44:04.490000+00:00,2688,716,We should protect our nature better in order to continue to have a life worth living in the future ,positive,0.8724215030670166
"180000 Covid 19 patients death in the USA due to our Government's late, slow, disastrous and not strong response to the situation. They could have done better to protect the lives of the citizen. Our government need to step up, become much faster and smarter. ","{coronavirus,government,"""",response}",2020-09-05 07:33:07.691000+00:00,2020-09-07 12:44:04.490000+00:00,2688,717, Covid patients death in the USA due to our Governments late slow disastrous and not strong response to the situation They could have done better to protect the lives of the citizen Our government need to step up become much faster and smarter ,negative,0.8791600465774536
I think GMO foods are generally good for you and definitely not harmful. ,{GMOgood},2020-09-05 09:02:49.899000+00:00,2020-09-05 09:02:49.908000+00:00,2734,718,I think GMO foods are generally good for you and definitely not harmful ,positive,0.864377498626709
"If I did something like this at my job, I'd be fired.  Trump administration is not doing enough. #covid #covidfailure",,2020-09-05 11:01:46.146000+00:00,2020-09-07 12:44:04.490000+00:00,2542,719,If I did something like this at my job Id be fired Trump administration is not doing enough covid covidfailure,negative,0.9932945966720581
"I used to think that the USA should just stick to its own business, kwim?  But this covid thing got me thinking - how much could the pandemic have been lessened if we were really proactive in the way we relate to other countries, obviously China in this case, but thinking of the future, too.  How should this affect the way we see our role around the world?  What do you think?  Stick to our own problems, or be active globally?",{foreignaffairs},2020-09-05 11:25:30.421000+00:00,2020-09-05 11:25:30.439000+00:00,2544,720,I used to think that the USA should just stick to its own business kwim But this covid thing got me thinking how much could the pandemic have been lessened if we were really proactive in the way we relate to other countries obviously China in this case but thinking of the future too How should this affect the way we see our role around the world What do you think Stick to our own problems or be active globally,negative,0.9080889225006104
"I honestly think people around the world are looking at the US - the lack of an effective response to covid, police killing unarmed minorities, the eviction crisis, and our commander in chief and saying, please get your sh!t together and then tell us how we should run our countries.",,2020-09-05 12:02:22.905000+00:00,2020-09-07 12:44:04.490000+00:00,2545,721,I honestly think people around the world are looking at the US the lack of an effective response to covid police killing unarmed minorities the eviction crisis and our commander in chief and saying please get your sht together and then tell us how we should run our countries,negative,0.5623542666435242
"Like a lot of people, I really think we've got to have a wealth tax. Two percent on wealth above $50 million is a very modest price for the extremely wealthy to pay to get our fiscal priorities straight and help fight inequality.","{""""}",2020-09-05 12:12:07.864000+00:00,2020-09-05 12:12:07.876000+00:00,2596,722,Like a lot of people I really think weve got to have a wealth tax Two percent on wealth above million is a very modest price for the extremely wealthy to pay to get our fiscal priorities straight and help fight inequality,negative,0.7132250070571899
