text,tags,createdAt,updatedAt,AuthorId,PostID,norm_text,labels,scores
"Today in history - 
On September 6, 1915, a prototype tank nicknamed Little Willie rolls off the assembly line in England. Little Willie was far from an overnight success. It weighed 14 tons, got stuck in trenches and crawled over rough terrain at only two miles per hour. However, improvements were made to the original prototype and tanks eventually transformed military battlefields.","{""""}",2020-09-06 16:09:37.759000+00:00,2020-09-07 12:44:04.518000+00:00,2658,918,Today in history On September a prototype tank nicknamed Little Willie rolls off the assembly line in England Little Willie was far from an overnight success It weighed tons got stuck in trenches and crawled over rough terrain at only two miles per hour However improvements were made to the original prototype and tanks eventually transformed military battlefields,negative,0.8831229209899902
"How do you define socialized healthcare because there is a difference between that and  what is called universal coverage in which a system where everyone has health insurance.

Switzerland - Universal coverage
Canada -socialized, or “single-payer,” health insurance
UK - truly socialized medicine NHS

TRUE socialized medicine has seen problem after problem - do you just want to walk in a store and have one choice of an item? That's what you would get with socialized healthcare.","{healthcare,socializedmedicine}",2020-09-06 16:11:39.546000+00:00,2020-09-06 16:11:39.556000+00:00,2649,919,How do you define socialized healthcare because there is a difference between that and what is called universal coverage in which a system where everyone has health insurance Switzerland Universal coverage Canada socialized or singlepayer health insurance UK truly socialized medicine NHS TRUE socialized medicine has seen problem after problem do you just want to walk in a store and have one choice of an item Thats what you would get with socialized healthcare,positive,0.5588419437408447
we need to stop using nuclear energy just like fossil fuels it is just an archaic way to do things we have so much opportunity to use other energy sources that does not harm people ,"{nuclear,enviroment,energy}",2020-09-06 16:33:14.696000+00:00,2020-09-07 12:44:04.508000+00:00,2580,920,we need to stop using nuclear energy just like fossil fuels it is just an archaic way to do things we have so much opportunity to use other energy sources that does not harm people ,positive,0.5201238989830017
"This is an old (but funny!) video that to me, encapsulates why we need to work on our own issues before taking a more active role internationally.  Noah here is giving his view as someone who'd recently immigrated to America.  I've travelled a bit, and it's so true, this is how people see Trump, so are they going to listen when we tell them what's wrong with their countries?  Nope, they see right through the corruption and nepotism, they're very familiar with that and they know what it looks like.

Work on America first, folks.

https://www.youtube.com/watch?v=2FPrJxTvgdQ","{""""}",2020-09-06 16:36:44.771000+00:00,2020-09-06 16:36:56.910000+00:00,2543,921,This is an old but funny video that to me encapsulates why we need to work on our own issues before taking a more active role internationally Noah here is giving his view as someone whod recently immigrated to America Ive travelled a bit and its so true this is how people see Trump so are they going to listen when we tell them whats wrong with their countries Nope they see right through the corruption and nepotism theyre very familiar with that and they know what it looks like Work on America first folks ,negative,0.5177496671676636
Finally took my cans to the recycling center. Got a decent amount back that I'm going to use for Labor day. STAY SAFE,"{Environment,Laborday,Covidsafety}",2020-09-06 16:56:20.453000+00:00,2020-09-06 16:56:20.463000+00:00,2711,922,Finally took my cans to the recycling center Got a decent amount back that Im going to use for Labor day STAY SAFE,negative,0.8060831427574158
"Time and time again, GMO foods have been safe. I have to agree since just about everyone eats them and I haven't heard of mass deaths caused from them!","{GMO,food,death,safe}",2020-09-06 17:13:37.928000+00:00,2020-09-07 12:44:04.519000+00:00,2703,923,Time and time again GMO foods have been safe I have to agree since just about everyone eats them and I havent heard of mass deaths caused from them,negative,0.8493450880050659
Why should the wealthy have to be taxed more? It's their money. It isn't fair that they should have to pay more just because they have more. ,"{Wealthy,Money,Tax,Pay}",2020-09-06 17:16:04.898000+00:00,2020-09-06 17:16:04.913000+00:00,2703,924,Why should the wealthy have to be taxed more Its their money It isnt fair that they should have to pay more just because they have more ,negative,0.9931724071502686
One difference between the Spanish Flu of 1918 and COVID-19? The White House/government wasn't involved! The government is doing too much and is dictating what we are doing. Enough!,"{Government,COVID,Coronavirus,WhiteHouse}",2020-09-06 17:18:24.022000+00:00,2020-09-06 17:18:27.571000+00:00,2703,925,One difference between the Spanish Flu of and COVID The White Housegovernment wasnt involved The government is doing too much and is dictating what we are doing Enough,negative,0.8500670194625854
the dow jones will not be down 20% it will continue to rise,{economy},2020-09-06 18:01:28.262000+00:00,2020-09-06 18:01:28.279000+00:00,2580,926,the dow jones will not be down it will continue to rise,negative,0.5999126434326172
People are not taking COVID 19 serious and leaders on a national level refuse to create policies that would decrease the spread. https://www.statnews.com/2020/09/04/fauci-labor-day-covid-19/. ,{wearamask},2020-09-06 18:09:43.949000+00:00,2020-09-06 18:09:43.967000+00:00,2701,927,People are not taking COVID serious and leaders on a national level refuse to create policies that would decrease the spread ,negative,0.8043432235717773
"The spread of COVID 19 in the U.S. is and will continue to be out of control unless leaders create policies to control the spread. Photo is from a social gathering in Ybor City, Tampa, FL.","{""""}",2020-09-06 18:22:08.288000+00:00,2020-09-06 18:22:08.305000+00:00,2701,928,The spread of COVID in the US is and will continue to be out of control unless leaders create policies to control the spread Photo is from a social gathering in Ybor City Tampa FL,negative,0.8854687809944153
"I saw this article today and it is really incomprehensibly evil, how our nation has failed in dealing with this pandemic.  A test costs $8, and his own employer charged this doctor over $10,000.

How on earth can we allow such greed, at the cost of so many lives?  

https://www.propublica.org/article/a-doctor-went-to-his-own-employer-for-a-covid-19-antibody-test-it-cost-10-984?utm_medium=social&utm_source=twitter#995019","{covid,covidfailure}",2020-09-06 18:24:38.521000+00:00,2020-09-07 12:44:04.500000+00:00,2542,929,I saw this article today and it is really incomprehensibly evil how our nation has failed in dealing with this pandemic A test costs and his own employer charged this doctor over How on earth can we allow such greed at the cost of so many lives ,negative,0.7737212777137756
"U.S. assistance in world affairs can have positive outcomes, such as combating hunger, https://www.bread.org/hunger-programs#:~:text=With%20continued%20and%20increased%20funding,%2C%20conflicts%2C%20and%20other%20disasters.","{""""}",2020-09-06 18:31:08.066000+00:00,2020-09-06 18:31:08.078000+00:00,2701,930,US assistance in world affairs can have positive outcomes such as combating hunger ,positive,0.7257972359657288
"180,000 Just think about that number, people.  This is insane. That's more people than the number of our soldiers have died in combat since the Korean war. 

#shame #covid #covidfailure",,2020-09-06 18:37:04.684000+00:00,2020-09-06 18:37:08.268000+00:00,2540,931, Just think about that number people This is insane Thats more people than the number of our soldiers have died in combat since the Korean war shame covid covidfailure,negative,0.9604494571685791
"180,000 Just think about that number, people.  This is insane. That's more people than the number of our soldiers have died in combat since the Korean war. 

#shame #covid #covidfailure",,2020-09-06 18:37:13.516000+00:00,2020-09-07 12:44:04.511000+00:00,2540,932, Just think about that number people This is insane Thats more people than the number of our soldiers have died in combat since the Korean war shame covid covidfailure,negative,0.9604494571685791
Poll:  Do you think there will be another terrorist attack on the United States in the next few years?,{terrorism},2020-09-06 18:43:58.386000+00:00,2020-09-07 12:44:04.509000+00:00,2658,933,Poll Do you think there will be another terrorist attack on the United States in the next few years,negative,0.9881610870361328
"You can look at the thousands dead, millions who've lost jobs and/or been evicted, and some people will still say our government had no way of knowing what was coming and did a reasonably good job - the best they could.  I beg to differ.  Look at other nations around the world.  The virus is nasty.  No one is disputing that.  But we have failed.  Look at their responses compared to our government response.  Look at the results.

https://www.usatoday.com/story/news/nation/2020/08/20/us-covid-19-response-how-miscommunication-selfishness-played-role/5610047002/

Take a good, hard look.  Facts, people.

","{covid,covidfailure}",2020-09-06 18:45:10.507000+00:00,2020-09-07 12:44:04.504000+00:00,2540,934,You can look at the thousands dead millions whove lost jobs andor been evicted and some people will still say our government had no way of knowing what was coming and did a reasonably good job the best they could I beg to differ Look at other nations around the world The virus is nasty No one is disputing that But we have failed Look at their responses compared to our government response Look at the results Take a good hard look Facts people ,negative,0.5863118767738342
"Why are people even debating using nuclear energy all these decades later when it's been proven that other technologies are more effective and cheaper?

Solar? Biodiesel? Natural gas? Wind power? The time for nuclear energy is over.","{environment,energy,nuclear}",2020-09-06 19:08:17.028000+00:00,2020-09-06 19:08:17.045000+00:00,2610,935,Why are people even debating using nuclear energy all these decades later when its been proven that other technologies are more effective and cheaper Solar Biodiesel Natural gas Wind power The time for nuclear energy is over,positive,0.5810120701789856
"One of the major issues with GMO crops is food plants are genetically engineered to be resistant to Roundup.  These genetically engineered ""Roundup Ready"" crops have proven deficiencies in important micronutrients like manganese as well as potentially even more important nutrients like iron or zinc.  This is scary! All of these nutrients are necessary to keep our bodies functioning properly.  http://www.growersmineral.com/crops/indepth-articles/glyphosate-and-micronutrients","{GMO,NoMutantFood}",2020-09-06 19:17:02.077000+00:00,2020-09-06 19:17:02.093000+00:00,2667,936,One of the major issues with GMO crops is food plants are genetically engineered to be resistant to Roundup These genetically engineered Roundup Ready crops have proven deficiencies in important micronutrients like manganese as well as potentially even more important nutrients like iron or zinc This is scary All of these nutrients are necessary to keep our bodies functioning properly ,negative,0.7116743922233582
"U.S. cases and deaths due to COVID 19 increase daily, nothing is being done to stop the spread. Our leaders have failed us. ","{""""}",2020-09-06 19:18:26.055000+00:00,2020-09-06 19:18:26.072000+00:00,2701,937,US cases and deaths due to COVID increase daily nothing is being done to stop the spread Our leaders have failed us ,negative,0.8482120037078857
"Sorry folks, hate to say it but economic recovery is still very slow.  There was some decline in unemployment for August, but most economists predict that we can't have any kind of meaningful recovery until we have a working vaccine to get the coronavirus pandemic under control.  This is not good news for the Dow.  https://kstp.com/national/august-jobs-report-likely-to-point-to-a-still-slow-recovery/5851162/",{Dow},2020-09-06 19:28:02.719000+00:00,2020-09-06 19:28:02.729000+00:00,2667,938,Sorry folks hate to say it but economic recovery is still very slow There was some decline in unemployment for August but most economists predict that we cant have any kind of meaningful recovery until we have a working vaccine to get the coronavirus pandemic under control This is not good news for the Dow ,negative,0.7994972467422485
"In more not so great economic news, the Dow dropped 1.8% last week.  All of the bad economic news is worrying, I agree with many economists that we really can't have a true recovery til there is a vaccine, which likely won't be til after the end of this year.  https://tradingeconomics.com/united-states/stock-market",{Dow},2020-09-06 19:33:04.090000+00:00,2020-09-06 19:33:04.102000+00:00,2667,939,In more not so great economic news the Dow dropped last week All of the bad economic news is worrying I agree with many economists that we really cant have a true recovery til there is a vaccine which likely wont be til after the end of this year ,positive,0.5496281981468201
Did you know that the FDA does not require any pre market safety testing of genetically engineered foods?  I had no idea!  That's worrisome.  https://www.centerforfoodsafety.org/issues/311/ge-foods/ge-food-and-your-health,"{GMO,NoMutantFood}",2020-09-06 19:37:36.190000+00:00,2020-09-06 19:37:36.201000+00:00,2667,940,Did you know that the FDA does not require any pre market safety testing of genetically engineered foods I had no idea Thats worrisome ,negative,0.989882230758667
"4 Days Ago on Twitter (not flagged as being false info):
The DOW JONES just eclipsed 29,000 - on track for a record high just months after a record drop.",{DowJones},2020-09-06 19:37:57.867000+00:00,2020-09-06 19:37:57.876000+00:00,2655,941, Days Ago on Twitter not flagged as being false info The DOW JONES just eclipsed on track for a record high just months after a record drop,negative,0.8610820770263672
"Stop fearmongering about 'Medicare for All.' Most families would pay less for better care.
The case for Medicare for All is simple. It would cover everyone, period. Done right, it would lower costs. And it would ease paperwork and confusion.

https://www.usatoday.com/story/opinion/2019/10/22/medicare-all-simplicity-savings-better-health-care-column/4055597002/

Perfect article, proof for sure. Let's let everyone at least have a CHANCE to buy into it, get insurance through Medicare if they WANT.
# USAtodaymedicare","{"""",USAtodaymedicare}",2020-09-06 19:43:26.283000+00:00,2020-09-06 19:43:26.291000+00:00,2389,942,Stop fearmongering about Medicare for All Most families would pay less for better care The case for Medicare for All is simple It would cover everyone period Done right it would lower costs And it would ease paperwork and confusion Perfect article proof for sure Lets let everyone at least have a CHANCE to buy into it get insurance through Medicare if they WANT USAtodaymedicare,negative,0.8945260643959045
This is so true. I agree. ,,2020-09-06 19:45:38.940000+00:00,2020-09-06 19:45:38.948000+00:00,2389,943,This is so true I agree ,positive,0.994070827960968
"While there have been no human trials of GMO foods (concerning just on its own!) animal trials have shown that GMO foods can cause many health problems including infertility, immune problems, faulty insulin regulation, and changes to major organs and the gastrointestinal system.  Scary stuff!  Watch what you eat and be safe out there!  https://www.piedmont.org/living-better/genetically-modified-foods-helpful-or-harmful","{GMO,NoMutantFoods}",2020-09-06 19:51:36.762000+00:00,2020-09-06 19:51:36.772000+00:00,2667,944,While there have been no human trials of GMO foods concerning just on its own animal trials have shown that GMO foods can cause many health problems including infertility immune problems faulty insulin regulation and changes to major organs and the gastrointestinal system Scary stuff Watch what you eat and be safe out there ,negative,0.9260218739509583
"Bioterrorism vs warfare - Which is more of a threat?

As stated by Bill Gates over 3 years ago.

https://www.theguardian.com/technology/2017/feb/18/bill-gates-warns-tens-of-millions-could-be-killed-by-bio-terrorism","{""""}",2020-09-06 19:51:48.785000+00:00,2020-09-07 12:44:04.502000+00:00,2702,945,Bioterrorism vs warfare Which is more of a threat As stated by Bill Gates over years ago ,negative,0.956941545009613
"Agree, clean energy and solar need more investment and focus.",,2020-09-06 20:00:56.969000+00:00,2020-09-06 20:00:56.978000+00:00,2610,946,Agree clean energy and solar need more investment and focus,positive,0.5209760665893555
Hard disagree with this point. The costs of wind and solar will come down if we put the time and effort to making them more mainstream.,,2020-09-06 20:03:03.612000+00:00,2020-09-06 20:03:03.626000+00:00,2610,947,Hard disagree with this point The costs of wind and solar will come down if we put the time and effort to making them more mainstream,negative,0.6373924612998962
"Oh Yes, schools are doing so great they had to reclose and send the student back to Mommy and Daddy.  Evidently, they forgot to wear their masks at the drunken frat parties.  The states would be the ones to do a mandate mask wearing, not the Federal Government and the Democratic states can't even handle their months of riots.  Who will they get to monitor mask wearing?  Inquiring minds want to know.",,2020-09-06 20:09:00.215000+00:00,2020-09-06 20:09:00.222000+00:00,2577,948,Oh Yes schools are doing so great they had to reclose and send the student back to Mommy and Daddy Evidently they forgot to wear their masks at the drunken frat parties The states would be the ones to do a mandate mask wearing not the Federal Government and the Democratic states cant even handle their months of riots Who will they get to monitor mask wearing Inquiring minds want to know,negative,0.8760300874710083
"I think they used to call those people ""Snake Oil Salesmen""...:)",,2020-09-06 20:10:06.478000+00:00,2020-09-06 20:10:06.496000+00:00,2577,949,I think they used to call those people Snake Oil Salesmen,negative,0.8866873979568481
"Wow, is that a current photo?  I don't see one mask.",,2020-09-06 20:10:59.467000+00:00,2020-09-06 20:10:59.482000+00:00,2577,950,Wow is that a current photo I dont see one mask,positive,0.7629134654998779
Happy Labor Day to you too.  We have enjoyed the beautiful weather outside today too.  Love nature and fresh air.  ,,2020-09-06 20:12:09.239000+00:00,2020-09-06 20:12:09.256000+00:00,2577,951,Happy Labor Day to you too We have enjoyed the beautiful weather outside today too Love nature and fresh air ,positive,0.9267464876174927
"Trump is THE change, Biden is the reason we needed a change.  I asked a Biden supporter to name 1 game changing thing he ever did in his 47 years.  They stood there and literally could not think of one thing.  So very sad.",,2020-09-06 20:14:15.082000+00:00,2020-09-06 20:14:15.092000+00:00,2577,952,Trump is THE change Biden is the reason we needed a change I asked a Biden supporter to name game changing thing he ever did in his years They stood there and literally could not think of one thing So very sad,negative,0.8962069749832153
"Since we went to organic and whole foods, our health has improved tremendously.  We now have friends doing the same.  Feels good to be an ""influencer"" at our age!",,2020-09-06 20:16:06.740000+00:00,2020-09-06 20:16:06.755000+00:00,2577,953,Since we went to organic and whole foods our health has improved tremendously We now have friends doing the same Feels good to be an influencer at our age,positive,0.9293892979621887
Kudos Dustin.  Well said.,,2020-09-06 20:17:30.702000+00:00,2020-09-06 20:17:30.721000+00:00,2577,954,Kudos Dustin Well said,positive,0.9694541692733765
"Agreed.  As a former business owner who employed 300 people, that is how I shared wealth.  I employed people.  ",,2020-09-06 20:19:19.974000+00:00,2020-09-06 20:19:19.998000+00:00,2577,955,Agreed As a former business owner who employed people that is how I shared wealth I employed people ,positive,0.6408756971359253
"UPDATE:  ""Some have erroneously suggested that the Trump administration threw out the pandemic response playbook left by the Obama-Biden administration,"" McEnany said, holding up a packet of papers. ""What the critics failed to note, however, is that this thin packet of paper was replaced by two detailed, robust pandemic response reports commissioned by the Trump administration."" ",,2020-09-06 20:22:52.447000+00:00,2020-09-06 20:22:52.456000+00:00,2577,956,UPDATE Some have erroneously suggested that the Trump administration threw out the pandemic response playbook left by the ObamaBiden administration McEnany said holding up a packet of papers What the critics failed to note however is that this thin packet of paper was replaced by two detailed robust pandemic response reports commissioned by the Trump administration ,negative,0.8907268047332764
GMO's scare me.  A chart won't change that.,,2020-09-06 20:25:13.280000+00:00,2020-09-06 20:25:13.294000+00:00,2577,957,GMOs scare me A chart wont change that,positive,0.9308004975318909
"90% Of All Scientists say GMO's are safe
[LINK](https://www.nytimes.com/2018/04/23/well/eat/are-gmo-foods-safe.html)",,2020-09-06 20:25:55.902000+00:00,2020-09-07 12:44:04.503000+00:00,2658,958, Of All Scientists say GMOs are safe LINK,negative,0.5442085266113281
"We have been living with GMO for more than three decades: if there was something objectively negative against them - beyond hunch, bad vibes and undocumented fears - I think we would have already observed it.",{GMO},2020-09-06 20:32:36.430000+00:00,2020-09-06 20:32:37.448000+00:00,2620,959,We have been living with GMO for more than three decades if there was something objectively negative against them beyond hunch bad vibes and undocumented fears I think we would have already observed it,negative,0.914621114730835
"Here are just a few advantages of GMO:

The crops are protected against viruses, insects and weeds.

Thanks to herbicide and pesticide tolerant plants, these are used less, which is good for the environment and the economy, because they reduce costs.

The fruits are more resistant, durable or even more nutritious.

They are prepared to develop in sterile or drought areas where until now it was practically impossible to plant.

Larger fruits are obtained and, consequently, more profitable.

Proteins can be added to help fight disease and malnutrition.

Plants and animals grow faster.

As a consequence of tolerance and resistance, theoretically, crop yields will increase and over time will contribute to a better supply of a multiplying population.",{GMO},2020-09-06 20:38:39.051000+00:00,2020-09-06 20:38:39.059000+00:00,2620,960,Here are just a few advantages of GMO The crops are protected against viruses insects and weeds Thanks to herbicide and pesticide tolerant plants these are used less which is good for the environment and the economy because they reduce costs The fruits are more resistant durable or even more nutritious They are prepared to develop in sterile or drought areas where until now it was practically impossible to plant Larger fruits are obtained and consequently more profitable Proteins can be added to help fight disease and malnutrition Plants and animals grow faster As a consequence of tolerance and resistance theoretically crop yields will increase and over time will contribute to a better supply of a multiplying population,negative,0.782718300819397
