id,text,createdAt,updatedAt,PostId,CommenterId,AuthorId,norm_text,labels,scores
51,"Nuclear energy, with proper safety in place, is one the cleanest and most efficient forms of energy there is. ",2020-09-03 02:19:56.218000+00:00,2020-09-03 02:19:56.226000+00:00,93.0,2593.0,2593,Nuclear energy with proper safety in place is one the cleanest and most efficient forms of energy there is ,positive,0.9929952025413513
52,"but it creates nuclear waste,has major accidents,causing a risk of cancer,and the cost of nuclear energy is higher than others in comparrison.",2020-09-03 02:41:38.743000+00:00,2020-09-03 02:41:38.751000+00:00,93.0,2580.0,2580,but it creates nuclear wastehas major accidentscausing a risk of cancerand the cost of nuclear energy is higher than others in comparrison,negative,0.5830507278442383
53,"I do not think the government has went to far.They are simply asking people to wear a mask, out of respect of others.",2020-09-03 02:42:26.089000+00:00,2020-09-03 02:42:26.097000+00:00,98.0,2580.0,2580,I do not think the government has went to farThey are simply asking people to wear a mask out of respect of others,negative,0.7765445113182068
54,while I can see that as being a global citizen I think its best we keep out since we have our own problems,2020-09-03 02:43:02.103000+00:00,2020-09-03 02:43:02.110000+00:00,96.0,2580.0,2580,while I can see that as being a global citizen I think its best we keep out since we have our own problems,positive,0.6145205497741699
55,it can happen again and can be deadlier due to technology,2020-09-03 02:43:30.800000+00:00,2020-09-03 02:43:30.807000+00:00,94.0,2580.0,2580,it can happen again and can be deadlier due to technology,negative,0.8976531624794006
56,"What about school closings, closed restaurants and other businesses? The economy is suffering, open the country!",2020-09-03 02:44:32.611000+00:00,2020-09-03 02:44:32.619000+00:00,98.0,2593.0,2593,What about school closings closed restaurants and other businesses The economy is suffering open the country,negative,0.889773964881897
57,I completely agree! It's not right!,2020-09-03 02:46:43.855000+00:00,2020-09-03 02:46:43.863000+00:00,97.0,2679.0,2679,I completely agree Its not right,negative,0.617941677570343
58,"He won't, its up to us to take care of ourselves.",2020-09-03 02:48:05.635000+00:00,2020-09-03 02:48:05.646000+00:00,100.0,2679.0,2679,He wont its up to us to take care of ourselves,positive,0.9233289957046509
59,"Global problems are our problems: trade, world poverty, famine, immigration...",2020-09-03 02:48:06.980000+00:00,2020-09-03 02:48:06.988000+00:00,96.0,2593.0,2593,Global problems are our problems trade world poverty famine immigration,negative,0.9584930539131165
60,I think the government waited too long to do anything. Lockdown and restricting groups should have happened almost immediately. SARS was a warning no one heeded along with the MERS virus. ,2020-09-03 02:48:32.667000+00:00,2020-09-03 02:48:32.677000+00:00,98.0,2719.0,2719,I think the government waited too long to do anything Lockdown and restricting groups should have happened almost immediately SARS was a warning no one heeded along with the MERS virus ,negative,0.9814351797103882
65,"Security may be tighter, but we still get attacks, just on a smaller scale.",2020-09-03 02:49:27.705000+00:00,2020-09-03 02:49:27.712000+00:00,94.0,2679.0,2679,Security may be tighter but we still get attacks just on a smaller scale,negative,0.9415679574012756
66,"Couldn't agree more. Nature heals, but economic slowdowns and recessions inflict pain and suffering. ",2020-09-03 02:50:01.502000+00:00,2020-09-03 02:50:01.516000+00:00,99.0,2593.0,2593,Couldnt agree more Nature heals but economic slowdowns and recessions inflict pain and suffering ,negative,0.820297122001648
67,Its good to have our input on such matters. We can learn from others and they can learn from us.,2020-09-03 02:52:09.278000+00:00,2020-09-03 02:52:09.303000+00:00,96.0,2679.0,2679,Its good to have our input on such matters We can learn from others and they can learn from us,positive,0.7419086694717407
68,California is leading the way: https://www.forbes.com/sites/robertwood/2020/08/17/california-proposes-168-income-tax-rate-plus-4-wealth-tax/,2020-09-03 02:52:38.450000+00:00,2020-09-03 02:52:38.459000+00:00,97.0,2593.0,2593,California is leading the way ,positive,0.7331387400627136
69,"Not sure we are fully secure here. Technology constantly changes and with that change come new exploits not caught. Those exploits will make us vulnerable. Homeland security is relatively a new entity created out of 911, although not a fail proof entity.",2020-09-03 02:54:01.828000+00:00,2020-09-03 02:54:01.840000+00:00,94.0,2719.0,2719,Not sure we are fully secure here Technology constantly changes and with that change come new exploits not caught Those exploits will make us vulnerable Homeland security is relatively a new entity created out of although not a fail proof entity,negative,0.6257495880126953
70,"I feel like we are moving away from nuclear energy, but at much too slow a pace.",2020-09-03 02:54:27.349000+00:00,2020-09-03 02:54:27.362000+00:00,93.0,2679.0,2679,I feel like we are moving away from nuclear energy but at much too slow a pace,positive,0.7647529244422913
71,"But nothing like 911, certainly not over 1000 deaths.",2020-09-03 02:54:48.831000+00:00,2020-09-03 02:54:48.841000+00:00,94.0,2593.0,2593,But nothing like certainly not over deaths,negative,0.9998836517333984
72,Agreed!,2020-09-03 02:55:53.691000+00:00,2020-09-03 02:55:53.700000+00:00,96.0,2593.0,2593,Agreed,positive,0.8717947006225586
74,Campaign reelection promise: no more Covid! Vaccine by Nov 3.,2020-09-03 02:57:19.499000+00:00,2020-09-03 02:57:19.509000+00:00,100.0,2593.0,2593,Campaign reelection promise no more Covid Vaccine by Nov ,negative,0.6563994288444519
76,Nature will only heal if we leave it alone to do it's thing... If we keep destroying it and building on it it's not going to get a chance to heal. Economic growth needs to be able to work without destroying the planet.,2020-09-03 02:57:25.812000+00:00,2020-09-03 02:57:25.821000+00:00,99.0,2657.0,2657,Nature will only heal if we leave it alone to do its thing If we keep destroying it and building on it its not going to get a chance to heal Economic growth needs to be able to work without destroying the planet,negative,0.9504740238189697
77,"My net worth is so far removed from 50 million, the issue seems almost farcical. As if it's a beyond-first-world-problems. And would be a comment only the one per-center's get.",2020-09-03 02:58:05.176000+00:00,2020-09-03 02:58:05.187000+00:00,97.0,2719.0,2719,My net worth is so far removed from million the issue seems almost farcical As if its a beyondfirstworldproblems And would be a comment only the one percenters get,negative,0.7814386487007141
78,"Open the country to keep the Dow alive. 30,000 by Nov 3",2020-09-03 03:04:14.649000+00:00,2020-09-03 03:04:14.658000+00:00,104.0,2593.0,2593,Open the country to keep the Dow alive by Nov ,positive,0.6449601054191589
79,"It makes sense, nature will still be around once we're gone, but we need to get by as well, and for that we need an economy.",2020-09-03 03:04:48.007000+00:00,2020-09-03 03:04:48.020000+00:00,105.0,2679.0,2679,It makes sense nature will still be around once were gone but we need to get by as well and for that we need an economy,negative,0.5974141359329224
82,You are violating the rights of others by not wearing a mask.,2020-09-03 03:05:17.372000+00:00,2020-09-03 03:05:17.386000+00:00,98.0,2604.0,2604,You are violating the rights of others by not wearing a mask,positive,0.9201202988624573
84,"""Keep your friend's close, and your enemies closer."" Knowing what the other side of the globe is doing is important. The U.S. doesn't want any nasty surprises.",2020-09-03 03:07:03.746000+00:00,2020-09-03 03:07:03.757000+00:00,96.0,2719.0,2719,Keep your friends close and your enemies closer Knowing what the other side of the globe is doing is important The US doesnt want any nasty surprises,negative,0.8496154546737671
87,"The government didn't act quick enough....If there had been a quicker response we wouldn't be looking at a death toll of over 180000
",2020-09-03 03:07:34.079000+00:00,2020-09-03 03:07:34.093000+00:00,98.0,2622.0,2622,The government didnt act quick enoughIf there had been a quicker response we wouldnt be looking at a death toll of over ,negative,0.9687200784683228
88,I agree,2020-09-03 03:07:35.163000+00:00,2020-09-03 03:07:35.170000+00:00,96.0,2604.0,2604,I agree,positive,0.9960008263587952
89,"Oil is dead, solar/wind is inefficient. Nuclear is one of the few remaining options. ",2020-09-03 03:08:48.598000+00:00,2020-09-03 03:08:48.608000+00:00,93.0,2593.0,2593,Oil is dead solarwind is inefficient Nuclear is one of the few remaining options ,negative,0.8314132690429688
90,A few buzz words from the past: Chernobyl. Fukushima. Forgetting history means we are doomed to repeat those mistakes. ,2020-09-03 03:10:55.077000+00:00,2020-09-03 03:10:55.087000+00:00,93.0,2719.0,2719,A few buzz words from the past Chernobyl Fukushima Forgetting history means we are doomed to repeat those mistakes ,negative,0.8902251124382019
91,Can you elaborate?,2020-09-03 03:11:34.663000+00:00,2020-09-03 03:11:34.677000+00:00,93.0,2604.0,2604,Can you elaborate,positive,0.9900917410850525
92,I wouldn't touch them...,2020-09-03 03:12:36.117000+00:00,2020-09-03 03:12:36.128000+00:00,107.0,2622.0,2622,I wouldnt touch them,positive,0.9887439012527466
93,Can't say I'm surprised.,2020-09-03 03:13:11.997000+00:00,2020-09-03 03:13:12.008000+00:00,102.0,2604.0,2604,Cant say Im surprised,negative,0.8509873747825623
94,The people making over 50 million dollars in this country are creating jobs for others and overall are contributing much more to society than they are taking away. This tax would be ridiculous and unfair.,2020-09-03 03:13:40.954000+00:00,2020-09-03 03:13:40.966000+00:00,97.0,2638.0,2638,The people making over million dollars in this country are creating jobs for others and overall are contributing much more to society than they are taking away This tax would be ridiculous and unfair,negative,0.8221179246902466
95,"I disagree. There are more security measures in place, but we are far from secure. There are so many ways that terrorists can threaten and kill us. foreign and American terrorists.",2020-09-03 03:14:50.751000+00:00,2020-09-03 03:14:50.760000+00:00,94.0,2665.0,2665,I disagree There are more security measures in place but we are far from secure There are so many ways that terrorists can threaten and kill us foreign and American terrorists,negative,0.9381814002990723
97,What sort of world affairs are you referring to?,2020-09-03 03:15:40.942000+00:00,2020-09-03 03:15:40.959000+00:00,96.0,2604.0,2604,What sort of world affairs are you referring to,positive,0.9916449785232544
98,opening the country would help out small businesses and not the big blue chip industries so i believe it would be going down. ,2020-09-03 03:15:45.046000+00:00,2020-09-03 03:15:45.057000+00:00,104.0,2657.0,2657,opening the country would help out small businesses and not the big blue chip industries so i believe it would be going down ,negative,0.8817822337150574
99,Still makes me nervous,2020-09-03 03:16:15.382000+00:00,2020-09-03 03:16:15.398000+00:00,94.0,2604.0,2604,Still makes me nervous,positive,0.6749096512794495
100,But why is it a bad idea?  Sounds pretty good to me.,2020-09-03 03:16:50.885000+00:00,2020-09-03 03:16:50.899000+00:00,97.0,2604.0,2604,But why is it a bad idea Sounds pretty good to me,negative,0.9078113436698914
103,lol.  Absolutely!,2020-09-03 03:17:46.363000+00:00,2020-09-03 03:17:46.371000+00:00,107.0,2604.0,2604,lol Absolutely,positive,0.9099275469779968
104,I don't necessarily agree.,2020-09-03 03:18:30.657000+00:00,2020-09-03 03:18:30.667000+00:00,109.0,2604.0,2604,I dont necessarily agree,negative,0.5786539316177368
105,Interesting...  I don't know though,2020-09-03 03:19:23.353000+00:00,2020-09-03 03:19:23.363000+00:00,103.0,2604.0,2604,Interesting I dont know though,positive,0.9498080015182495
106,I think that the Dow Jones's performance will be greatly affected by the results of the election later this year. I do not think that it will drop if Joe Biden is elected because people will be hopeful and willing to invest.,2020-09-03 03:19:38.873000+00:00,2020-09-03 03:19:38.882000+00:00,104.0,2638.0,2638,I think that the Dow Joness performance will be greatly affected by the results of the election later this year I do not think that it will drop if Joe Biden is elected because people will be hopeful and willing to invest,positive,0.7624695301055908
107,"Also, I believe that even if Donald Trump were reelected, that would give people a sense of stability, which would also encourage them to invest in the economy.",2020-09-03 03:20:20.664000+00:00,2020-09-03 03:20:20.673000+00:00,104.0,2638.0,2638,Also I believe that even if Donald Trump were reelected that would give people a sense of stability which would also encourage them to invest in the economy,positive,0.5523831248283386
108,I tend to agree with you,2020-09-03 03:20:50.104000+00:00,2020-09-03 03:20:50.119000+00:00,111.0,2604.0,2604,I tend to agree with you,positive,0.9748935699462891
110,"agree with you 100% nuclear power is damaging in the long run. 
#environment #cleanenergy",2020-09-03 03:21:14.548000+00:00,2020-09-03 03:21:14.632000+00:00,93.0,2665.0,2665,agree with you nuclear power is damaging in the long run environment cleanenergy,positive,0.9159207940101624
111,"This is one example why it is so important for the U.S. to take an active role in world affairs:
https://abcnews.go.com/Politics/us-declines-join-global-covid-19-vaccine-effort/story?id=72770704",2020-09-03 03:21:14.935000+00:00,2020-09-03 03:21:14.957000+00:00,96.0,2638.0,2638,This is one example why it is so important for the US to take an active role in world affairs ,positive,0.9191188216209412
112,We need to cooperate with other countries so that we can share in the important medical advances that they make. We can't afford to be left behind when we should be moving as fast as possible.,2020-09-03 03:21:26.254000+00:00,2020-09-03 03:21:26.270000+00:00,96.0,2638.0,2638,We need to cooperate with other countries so that we can share in the important medical advances that they make We cant afford to be left behind when we should be moving as fast as possible,negative,0.5574219226837158
113,agreed.,2020-09-03 03:21:31.648000+00:00,2020-09-03 03:21:31.655000+00:00,106.0,2604.0,2604,agreed,positive,0.8926036953926086
114,IF Joe biden is elected... There is a very good chance he will not get elected. Even if he does He wouldn't take office until after the year is over so I don't think anyone will be clamoring to invest before that.,2020-09-03 03:21:58.903000+00:00,2020-09-03 03:21:58.913000+00:00,104.0,2657.0,2657,IF Joe biden is elected There is a very good chance he will not get elected Even if he does He wouldnt take office until after the year is over so I dont think anyone will be clamoring to invest before that,negative,0.6081376075744629
116,Jack has it right.,2020-09-03 03:22:03.545000+00:00,2020-09-03 03:22:03.554000+00:00,98.0,2604.0,2604,Jack has it right,positive,0.9990021586418152
117,It makes absolutely no sense to try to withdraw from world affairs when the world is becoming more connected than ever.,2020-09-03 03:22:29.837000+00:00,2020-09-03 03:22:29.852000+00:00,96.0,2638.0,2638,It makes absolutely no sense to try to withdraw from world affairs when the world is becoming more connected than ever,positive,0.6670990586280823
118,yup.  agreed,2020-09-03 03:22:44.686000+00:00,2020-09-03 03:22:44.694000+00:00,110.0,2604.0,2604,yup agreed,positive,0.965583860874176
119,"If we cut ourselves off and isolate from the world, we will regret it when we need help in the future.",2020-09-03 03:23:01.078000+00:00,2020-09-03 03:23:01.089000+00:00,96.0,2638.0,2638,If we cut ourselves off and isolate from the world we will regret it when we need help in the future,positive,0.763763964176178
120,AGREED! What difference does is make if our economy is good right now when we are killing the planet for our kids and grandkids.,2020-09-03 03:23:13.039000+00:00,2020-09-03 03:23:13.050000+00:00,109.0,2665.0,2665,AGREED What difference does is make if our economy is good right now when we are killing the planet for our kids and grandkids,positive,0.9385550022125244
121,i don't know if i would equate a trump victory with stability. I think it will further divide the country and the dow will reflect that.,2020-09-03 03:23:47.606000+00:00,2020-09-03 03:23:47.615000+00:00,104.0,2657.0,2657,i dont know if i would equate a trump victory with stability I think it will further divide the country and the dow will reflect that,negative,0.651292085647583
122,"YES!!! Give people the option. 
#medicareforallwhowantit",2020-09-03 03:24:13.070000+00:00,2020-09-03 03:24:13.078000+00:00,106.0,2665.0,2665,YES Give people the option medicareforallwhowantit,negative,0.6690580248832703
123,true.  thanks to trump.  sigh.  need to vote him out of office!,2020-09-03 03:25:15.437000+00:00,2020-09-03 03:25:15.445000+00:00,104.0,2604.0,2604,true thanks to trump sigh need to vote him out of office,positive,0.9739290475845337
124,Waiting for Trump to help us? That's gonna be a long wait. ,2020-09-03 03:25:25.884000+00:00,2020-09-03 03:25:25.895000+00:00,100.0,2665.0,2665,Waiting for Trump to help us Thats gonna be a long wait ,negative,0.5714184045791626
125,Taxing people who make millions of dollars at high amounts just creates a disincentive to working harder and making more money. It stifles innovation and entrepreneurship.,2020-09-03 03:26:04.927000+00:00,2020-09-03 03:26:04.937000+00:00,101.0,2638.0,2638,Taxing people who make millions of dollars at high amounts just creates a disincentive to working harder and making more money It stifles innovation and entrepreneurship,negative,0.5971758961677551
126,you don't agree that the environment is suffering? ,2020-09-03 03:26:56.826000+00:00,2020-09-03 03:26:56.837000+00:00,109.0,2657.0,2657,you dont agree that the environment is suffering ,negative,0.569431483745575
127,"I disagree as I believe that Congress will pass more legislation enabling more rounds of stimulus checks sometime this year, and that will encourage people to invest.",2020-09-03 03:28:09.609000+00:00,2020-09-03 03:28:09.620000+00:00,104.0,2638.0,2638,I disagree as I believe that Congress will pass more legislation enabling more rounds of stimulus checks sometime this year and that will encourage people to invest,positive,0.8920658230781555
128,"While I don't think we should be turning a blind eye to world affairs, I would like to see us concentrate on us for once! Let's repair America!",2020-09-03 03:28:52.830000+00:00,2020-09-03 03:28:53.036000+00:00,96.0,2665.0,2665,While I dont think we should be turning a blind eye to world affairs I would like to see us concentrate on us for once Lets repair America,negative,0.5271661281585693
129,I do not understand why a wealth tax is needed since the marginal income tax rate is already so high.,2020-09-03 03:30:24.186000+00:00,2020-09-03 03:30:24.203000+00:00,103.0,2638.0,2638,I do not understand why a wealth tax is needed since the marginal income tax rate is already so high,negative,0.9733294248580933
131,"@Kathryn_3504  People who make 50 million dollars do not get to take home 50 million dollars at the end of the day. The real amount of much, much less.",2020-09-03 03:32:19.538000+00:00,2020-09-03 03:32:19.547000+00:00,97.0,2638.0,2638,Kathryn People who make million dollars do not get to take home million dollars at the end of the day The real amount of much much less,negative,0.9214578866958618
132,"Yes, nature has been around forever and will continue to be around forever. But the state of nature will probably not be one that is hospitable to human life eventually if we keep neglecting and abusing it! #earthfirst",2020-09-03 03:32:38.086000+00:00,2020-09-03 03:32:38.208000+00:00,99.0,2665.0,2665,Yes nature has been around forever and will continue to be around forever But the state of nature will probably not be one that is hospitable to human life eventually if we keep neglecting and abusing it earthfirst,positive,0.6845359802246094
134,"Upon further examination, I believe the U.S., WHO, and the CDC have over reacted with safety measures. Our chances of catching COVID-19 is only 1 percent. Let's open up the country now!",2020-09-03 03:35:14.711000+00:00,2020-09-03 03:35:14.727000+00:00,98.0,2719.0,2719,Upon further examination I believe the US WHO and the CDC have over reacted with safety measures Our chances of catching COVID is only percent Lets open up the country now,positive,0.692719042301178
136,The U.S. government has gone too far??? What? They haven't gone far enough! The number of Covid deaths and infections in our country is a travesty.,2020-09-03 03:47:53.994000+00:00,2020-09-03 03:47:54.006000+00:00,98.0,2665.0,2665,The US government has gone too far What They havent gone far enough The number of Covid deaths and infections in our country is a travesty,negative,0.9730216860771179
137,"yes, even though I think it is likely we could see another attack as bad...even an attack half as bad would be devastating and very likely.",2020-09-03 03:59:52.609000+00:00,2020-09-03 03:59:52.620000+00:00,94.0,2665.0,2665,yes even though I think it is likely we could see another attack as badeven an attack half as bad would be devastating and very likely,negative,0.9921949505805969
138,"I'm on your side. If we don't protect the environment, the environment won't protect us. We need to think long term here!",2020-09-03 04:03:31.409000+00:00,2020-09-03 04:03:31.422000+00:00,114.0,2665.0,2665,Im on your side If we dont protect the environment the environment wont protect us We need to think long term here,negative,0.6419042944908142
139,interesting read! thanks for posting.,2020-09-03 04:04:52.842000+00:00,2020-09-03 04:04:52.852000+00:00,113.0,2665.0,2665,interesting read thanks for posting,positive,0.9815120100975037
140,"yes, how many things have sounded great and then later we find out how harmful they are. weed killer sounded great. Plastic sounded great. let's really investigate and think this through before we consume it.",2020-09-03 04:09:01.907000+00:00,2020-09-03 04:09:01.919000+00:00,110.0,2665.0,2665,yes how many things have sounded great and then later we find out how harmful they are weed killer sounded great Plastic sounded great lets really investigate and think this through before we consume it,positive,0.7527406811714172
141,Why are you saying it is bad idea? What backs that up?,2020-09-03 04:10:43.730000+00:00,2020-09-03 04:10:43.743000+00:00,97.0,2665.0,2665,Why are you saying it is bad idea What backs that up,negative,0.998439610004425
142,Thank you Allison! If we don't protect mother Earth it doesn't matter how the economy does because we are going to spend countless billions or trillions trying to fix the damage global warming is doing.,2020-09-03 04:15:34.880000+00:00,2020-09-03 04:15:34.891000+00:00,114.0,2618.0,2618,Thank you Allison If we dont protect mother Earth it doesnt matter how the economy does because we are going to spend countless billions or trillions trying to fix the damage global warming is doing,negative,0.8387196660041809
143,Thanks Allison! By being so myopic we are opening ourselves up to other threats. We need to be vigilant!,2020-09-03 04:16:52.093000+00:00,2020-09-03 04:16:52.102000+00:00,113.0,2618.0,2618,Thanks Allison By being so myopic we are opening ourselves up to other threats We need to be vigilant,negative,0.5215407609939575
144,"It just makes sense to me that the more you make, the more you have to pay in taxes. Isn't that how it works for us ""little folk?"" I'm not trying to take advantage of the rich, but I think they can give a little more. ",2020-09-03 04:18:07.567000+00:00,2020-09-03 04:18:07.575000+00:00,115.0,2665.0,2665,It just makes sense to me that the more you make the more you have to pay in taxes Isnt that how it works for us little folk Im not trying to take advantage of the rich but I think they can give a little more ,negative,0.6999685168266296
145,"And how many rich are paying little or no taxes due to being able to take advantage of loopholes and such. I'm looking at you, Trump!",2020-09-03 04:18:51.211000+00:00,2020-09-03 04:18:51.221000+00:00,115.0,2665.0,2665,And how many rich are paying little or no taxes due to being able to take advantage of loopholes and such Im looking at you Trump,negative,0.7143867015838623
146,I wish it was possible to view a different reality where we had different leadership...To see what the response and outcome of the pandemic would have been.,2020-09-03 04:20:59.187000+00:00,2020-09-03 04:20:59.201000+00:00,102.0,2665.0,2665,I wish it was possible to view a different reality where we had different leadershipTo see what the response and outcome of the pandemic would have been,negative,0.6581338047981262
147,agreed. so many are lulled into a false sense of security.,2020-09-03 04:28:45.266000+00:00,2020-09-03 04:28:45.281000+00:00,113.0,2665.0,2665,agreed so many are lulled into a false sense of security,negative,0.9891595244407654
148,"The ""tax cuts"" unfortunately were skewed towards corporations and the wealthy. Even Warren Buffet said he was surprised how little taxes he pays.",2020-09-03 04:30:54.888000+00:00,2020-09-03 04:30:54.900000+00:00,115.0,2618.0,2618,The tax cuts unfortunately were skewed towards corporations and the wealthy Even Warren Buffet said he was surprised how little taxes he pays,negative,0.9964013695716858
