id,text,createdAt,updatedAt,PostId,CommenterId,AuthorId,norm_text,labels,scores
1301,Realistically we need to get through this crisis first before we are in a position to help other countries.,2020-09-07 02:14:17.816000+00:00,2020-09-07 02:14:17.823000+00:00,655.0,2667.0,2667,Realistically we need to get through this crisis first before we are in a position to help other countries,positive,0.7706800699234009
1302,"With so many losses from the virus, and our economy such a mess, we can't help others til we help ourselves first.",2020-09-07 02:15:53.281000+00:00,2020-09-07 02:15:53.299000+00:00,780.0,2667.0,2667,With so many losses from the virus and our economy such a mess we cant help others til we help ourselves first,positive,0.7075880765914917
1303,"There have been several outbreaks with increasing frequency in the past few
decades and many scientists were watching coronaviruses coming out of Asia.
Plenty of people thought we'd see a big pandemic sooner or later. Trump is
just useless, that's all!
",2020-09-07 02:15:55.305000+00:00,2020-09-07 02:15:55.312000+00:00,158.0,2456.0,2456,There have been several outbreaks with increasing frequency in the past few decades and many scientists were watching coronaviruses coming out of Asia Plenty of people thought wed see a big pandemic sooner or later Trump is just useless thats all ,negative,0.9401606917381287
1304,"Treat your mouth and nose like your d*ck... if strangers can see it in the store, you need to go back home.",2020-09-07 02:21:08.356000+00:00,2020-09-07 02:21:08.363000+00:00,783.0,2456.0,2456,Treat your mouth and nose like your dck if strangers can see it in the store you need to go back home,negative,0.7568450570106506
1305,"Yes, let's bring sanity back to the White House! ",2020-09-07 02:22:17.118000+00:00,2020-09-07 02:22:17.132000+00:00,897.0,2704.0,2704,Yes lets bring sanity back to the White House ,positive,0.8082379102706909
1306,LOL 2% won't come close to ruining their lives.  ,2020-09-07 02:24:16.817000+00:00,2020-09-07 02:24:16.826000+00:00,995.0,2704.0,2704,LOL wont come close to ruining their lives ,negative,0.557523787021637
1307,"True, the US was still a leader 4 years ago. What happened since then? Trump!",2020-09-07 02:25:52.389000+00:00,2020-09-07 02:25:54.065000+00:00,652.0,2704.0,2704,True the US was still a leader years ago What happened since then Trump,negative,0.6738356947898865
1308,I feel so sorry for the vulnerable people in our world who were affected by this. Some lost their lives. They were let down by the system. The vulnerable or weak or the ones that need the most help.,2020-09-07 02:26:56.459000+00:00,2020-09-07 02:26:56.467000+00:00,717.0,2454.0,2454,I feel so sorry for the vulnerable people in our world who were affected by this Some lost their lives They were let down by the system The vulnerable or weak or the ones that need the most help,negative,0.9270300269126892
1309,"Interesting data but this is from 2019, a little old? ",2020-09-07 02:27:36.501000+00:00,2020-09-07 02:27:36.516000+00:00,999.0,2575.0,2575,Interesting data but this is from a little old ,negative,0.916725754737854
1310,I hope so! They should do the right thing and help people who need it.,2020-09-07 02:32:48.848000+00:00,2020-09-07 02:32:48.856000+00:00,844.0,2454.0,2454,I hope so They should do the right thing and help people who need it,positive,0.9381795525550842
1311,You nailed it Malik. The government has failed in comparison to nearly every other government in the world.,2020-09-07 02:34:58.362000+00:00,2020-09-07 02:34:58.371000+00:00,934.0,2704.0,2704,You nailed it Malik The government has failed in comparison to nearly every other government in the world,negative,0.951129674911499
1312,Biden! We always need compassion and generosity but we especially need it NOW.,2020-09-07 02:36:32.800000+00:00,2020-09-07 02:36:32.808000+00:00,843.0,2454.0,2454,Biden We always need compassion and generosity but we especially need it NOW,positive,0.96101313829422
1313,It is already too late! But better late than never I guess...,2020-09-07 02:36:58.256000+00:00,2020-09-07 02:36:58.268000+00:00,964.0,2704.0,2704,It is already too late But better late than never I guess,negative,0.9833831787109375
1314,And people try to act like he is an evil mastermind trying to inject them with a microchip. smh,2020-09-07 02:39:01.980000+00:00,2020-09-07 02:39:01.996000+00:00,945.0,2704.0,2704,And people try to act like he is an evil mastermind trying to inject them with a microchip smh,negative,0.8899476528167725
1315,The big hedge funds make money in any direction the rest of us should stay out of the casino.,2020-09-07 02:43:32.362000+00:00,2020-09-07 02:43:34.478000+00:00,776.0,2454.0,2454,The big hedge funds make money in any direction the rest of us should stay out of the casino,negative,0.9243698716163635
1316,Trump sees right through this fake pandemic. He'll get the economy going again. You like jobs? Vote Trump!,2020-09-07 02:47:51.274000+00:00,2020-09-07 02:47:51.280000+00:00,843.0,2455.0,2455,Trump sees right through this fake pandemic Hell get the economy going again You like jobs Vote Trump,negative,0.9336217641830444
1317,Many people could foresee this and did. Trump simply doesn't care.,2020-09-07 02:51:07.202000+00:00,2020-09-07 02:51:07.340000+00:00,158.0,2734.0,2734,Many people could foresee this and did Trump simply doesnt care,negative,0.7155051231384277
1318,I agree. Spending time in nature is relaxing during these stressful times. Trump probably hasn't spent one day in nature.,2020-09-07 02:53:53.062000+00:00,2020-09-07 02:53:53.069000+00:00,537.0,2734.0,2734,I agree Spending time in nature is relaxing during these stressful times Trump probably hasnt spent one day in nature,negative,0.5958501100540161
1319,So sad and so unnecessary.,2020-09-07 02:55:07.266000+00:00,2020-09-07 02:55:07.274000+00:00,488.0,2734.0,2734,So sad and so unnecessary,negative,0.9999576807022095
1320,"Sadly, Trump doesn't understand or care about world affairs.",2020-09-07 02:56:38.942000+00:00,2020-09-07 02:56:38.950000+00:00,177.0,2734.0,2734,Sadly Trump doesnt understand or care about world affairs,negative,0.8438432812690735
1321,I don't want to cover my handsome face! Hello ladies!,2020-09-07 02:56:49.675000+00:00,2020-09-07 02:56:50.588000+00:00,864.0,2455.0,2455,I dont want to cover my handsome face Hello ladies,positive,0.6624580025672913
1322,Buy the dip!,2020-09-07 02:58:13.740000+00:00,2020-09-07 02:58:13.750000+00:00,550.0,2455.0,2455,Buy the dip,negative,0.9658834338188171
1323,"Remember in the very beginning when Dr. Fauci said the worst-case scenario was 100,000 deaths? Trump really mishandled this.",2020-09-07 03:00:25.363000+00:00,2020-09-07 03:00:25.372000+00:00,717.0,2734.0,2734,Remember in the very beginning when Dr Fauci said the worstcase scenario was deaths Trump really mishandled this,negative,0.9967533946037292
1324,But the situation is out of control. The death toll is estimated to double by January unless something changes. The government needs to get a handle on this ASAP.,2020-09-07 03:01:23.551000+00:00,2020-09-07 03:01:23.697000+00:00,743.0,2702.0,2702,But the situation is out of control The death toll is estimated to double by January unless something changes The government needs to get a handle on this ASAP,negative,0.9898794293403625
1325,It is not enough to vote Trump out in 2 months. Think of how many more unnecessary deaths there will be by then. Someone needs to do something NOW.,2020-09-07 03:02:29.018000+00:00,2020-09-07 03:02:29.026000+00:00,725.0,2734.0,2734,It is not enough to vote Trump out in months Think of how many more unnecessary deaths there will be by then Someone needs to do something NOW,negative,0.9976111054420471
1326,Terrorists exists on both sides!,2020-09-07 03:03:55.097000+00:00,2020-09-07 03:03:55.105000+00:00,734.0,2702.0,2702,Terrorists exists on both sides,negative,0.7338866591453552
1327,"They're young and healthy, the virus won't do anything to them.",2020-09-07 03:04:15.017000+00:00,2020-09-07 03:04:15.083000+00:00,846.0,2455.0,2455,Theyre young and healthy the virus wont do anything to them,positive,0.6542010307312012
1328,How much money does one person need? ,2020-09-07 03:04:15.104000+00:00,2020-09-07 03:04:15.117000+00:00,713.0,2734.0,2734,How much money does one person need ,negative,0.9806265830993652
1329,This is such a simple act that anyone can do to save lives. I truly don't understand why some people refuse to comply.,2020-09-07 03:05:07.241000+00:00,2020-09-07 03:05:07.251000+00:00,783.0,2734.0,2734,This is such a simple act that anyone can do to save lives I truly dont understand why some people refuse to comply,negative,0.7922110557556152
1330,I'm gonna buy stocks AND toilet paper!,2020-09-07 03:05:29.016000+00:00,2020-09-07 03:05:29.023000+00:00,842.0,2455.0,2455,Im gonna buy stocks AND toilet paper,negative,0.9989420771598816
1331,"I agree, for the sake of our health and the health of plants and animals.",2020-09-07 03:08:56.242000+00:00,2020-09-07 03:08:56.251000+00:00,716.0,2734.0,2734,I agree for the sake of our health and the health of plants and animals,positive,0.9017168283462524
1332,Agreed. Let's be there for others so we're not alone when we need help.,2020-09-07 03:11:07.857000+00:00,2020-09-07 03:11:07.866000+00:00,780.0,2734.0,2734,Agreed Lets be there for others so were not alone when we need help,negative,0.9856016635894775
1333,Yea I agree the risks far outweigh the benefits...,2020-09-07 03:12:44.955000+00:00,2020-09-07 03:12:44.970000+00:00,701.0,2575.0,2575,Yea I agree the risks far outweigh the benefits,negative,0.522053599357605
1334,That makes absolutely no sense. The government needs to set regulations and make sure everyone who wants to get tested can do so affordably.,2020-09-07 03:12:57.404000+00:00,2020-09-07 03:12:57.577000+00:00,929.0,2702.0,2702,That makes absolutely no sense The government needs to set regulations and make sure everyone who wants to get tested can do so affordably,negative,0.9409536123275757
1335,Yes we must stay the course and protect our nation! ,2020-09-07 03:13:11.612000+00:00,2020-09-07 03:13:11.623000+00:00,711.0,2575.0,2575,Yes we must stay the course and protect our nation ,positive,0.9413650631904602
1336,The amount of confusion surrounding the disease didn't help in the early days. The government needs to do a better job of keeping the public informed so that we can take the right actions and turn things around.,2020-09-07 03:16:15.041000+00:00,2020-09-07 03:16:16.940000+00:00,964.0,2702.0,2702,The amount of confusion surrounding the disease didnt help in the early days The government needs to do a better job of keeping the public informed so that we can take the right actions and turn things around,positive,0.6046155691146851
1337,"The amount of misinformation coming from the government is overwhelming. We need change, that's for sure.",2020-09-07 03:22:30.464000+00:00,2020-09-07 03:22:30.479000+00:00,875.0,2702.0,2702,The amount of misinformation coming from the government is overwhelming We need change thats for sure,negative,0.8199933171272278
1338,Not having to use pesticides due to GMO means that the pests either don't want or can't eat the crop... doesn't sound like food I want to touch!,2020-09-07 03:25:32.894000+00:00,2020-09-07 03:25:32.910000+00:00,124.0,2702.0,2702,Not having to use pesticides due to GMO means that the pests either dont want or cant eat the crop doesnt sound like food I want to touch,negative,0.7948927283287048
1339,"I hope you're right, but I wouldn't count on it. I hope the government is ready to handle what's to come.",2020-09-07 03:31:32.241000+00:00,2020-09-07 03:31:32.249000+00:00,1016.0,2702.0,2702,I hope youre right but I wouldnt count on it I hope the government is ready to handle whats to come,positive,0.5726008415222168
1340,"One day, the government tells you one thing, then the next day they turn around and tell you the complete opposite. They need to get their facts straight before spreading misinformation.",2020-09-07 03:34:43.045000+00:00,2020-09-07 03:34:43.057000+00:00,1015.0,2702.0,2702,One day the government tells you one thing then the next day they turn around and tell you the complete opposite They need to get their facts straight before spreading misinformation,negative,0.7731192708015442
1341,"If bioterrorism counts, then no!",2020-09-07 03:36:36.523000+00:00,2020-09-07 03:36:36.538000+00:00,885.0,2702.0,2702,If bioterrorism counts then no,negative,0.9988018870353699
1342,Why can't we protect both the economy and environment? ,2020-09-07 03:38:01.539000+00:00,2020-09-07 03:38:01.548000+00:00,660.0,2575.0,2575,Why cant we protect both the economy and environment ,positive,0.5756826400756836
1343,We have been warned!,2020-09-07 03:38:41.839000+00:00,2020-09-07 03:38:47.732000+00:00,945.0,2702.0,2702,We have been warned,negative,0.9999371767044067
1344,"Just because it doesn't kill you right away doesn't mean it isn't harming you for a slow death. Think cigarettes. It takes years before you see the effects but make no mistake, it will catch up with you eventually.",2020-09-07 03:49:18.305000+00:00,2020-09-07 03:49:18.315000+00:00,744.0,2702.0,2702,Just because it doesnt kill you right away doesnt mean it isnt harming you for a slow death Think cigarettes It takes years before you see the effects but make no mistake it will catch up with you eventually,negative,0.6058832406997681
1345,Who's your candidate of choice then? Sleepy Joe?,2020-09-07 03:49:22.882000+00:00,2020-09-07 03:49:22.890000+00:00,652.0,2575.0,2575,Whos your candidate of choice then Sleepy Joe,negative,0.8841850757598877
1346,This is a good decision but virtual learning is still the safest choice. ,2020-09-07 03:52:53.310000+00:00,2020-09-07 03:52:53.324000+00:00,846.0,2575.0,2575,This is a good decision but virtual learning is still the safest choice ,positive,0.7791558504104614
1347,"Like the idea of having an open discussion on topics, but this is too generalized. Bring something to the table.",2020-09-07 03:55:17.647000+00:00,2020-09-07 03:55:17.662000+00:00,879.0,2610.0,2610,Like the idea of having an open discussion on topics but this is too generalized Bring something to the table,negative,0.6708971858024597
1348,I agree 100%. Thanks for always having great posts. ,2020-09-07 04:50:08.077000+00:00,2020-09-07 04:50:08.086000+00:00,1009.0,2654.0,2654,I agree Thanks for always having great posts ,positive,0.8844829797744751
1349,Ya GMOs are dangerous and need to be closely monitored and watched. ,2020-09-07 04:50:45.590000+00:00,2020-09-07 04:50:45.602000+00:00,1001.0,2654.0,2654,Ya GMOs are dangerous and need to be closely monitored and watched ,negative,0.9295355081558228
1350,They might help crop yields but they hurt our health. #BoycottGMOs,2020-09-07 04:51:24.636000+00:00,2020-09-07 04:51:24.651000+00:00,999.0,2654.0,2654,They might help crop yields but they hurt our health BoycottGMOs,positive,0.6829824447631836
1351,I disagree. We are in a stock market bubble and it is due for a huge correction. ,2020-09-07 04:53:09.442000+00:00,2020-09-07 04:53:09.454000+00:00,816.0,2654.0,2654,I disagree We are in a stock market bubble and it is due for a huge correction ,negative,0.8983464241027832
1352,I think they will go down severely. We are in a stock market bubble with extremely inflated pe ratios. Sell your stocks!!!,2020-09-07 04:55:18.439000+00:00,2020-09-07 04:55:18.447000+00:00,706.0,2654.0,2654,I think they will go down severely We are in a stock market bubble with extremely inflated pe ratios Sell your stocks,negative,0.9198963046073914
1353,scientists can not be trusted. They are run by the left and the rich. Just like the climate change claims scientists can not be trusted!!!!,2020-09-07 04:56:21.270000+00:00,2020-09-07 04:56:21.279000+00:00,958.0,2654.0,2654,scientists can not be trusted They are run by the left and the rich Just like the climate change claims scientists can not be trusted,negative,0.9011131525039673
1354,This seems like fake news!!! Drain the swamp!,2020-09-07 04:57:10.084000+00:00,2020-09-07 04:57:10.092000+00:00,991.0,2654.0,2654,This seems like fake news Drain the swamp,negative,0.9550647735595703
1355,"A government that doesn't take care of its citizens is not much of a government at all. Yes, we need a better health care system, but to rally against Medicare For All accomplishes nothing.",2020-09-07 05:22:42.420000+00:00,2020-09-07 05:22:42.434000+00:00,581.0,2610.0,2610,A government that doesnt take care of its citizens is not much of a government at all Yes we need a better health care system but to rally against Medicare For All accomplishes nothing,negative,0.8013465404510498
1356,they were able to become wealthy b/c they had the societal infrastructure to do so.,2020-09-07 05:27:34.357000+00:00,2020-09-07 05:27:34.365000+00:00,741.0,2709.0,2709,they were able to become wealthy bc they had the societal infrastructure to do so,negative,0.9473322033882141
1357,The generation that destroys the environment won't be the one to face the consequences. This really hits hard,2020-09-07 07:43:30.815000+00:00,2020-09-07 07:43:30.823000+00:00,715.0,2688.0,2688,The generation that destroys the environment wont be the one to face the consequences This really hits hard,negative,0.9010280966758728
1358,"Wow, that's a harsh assessment but I think you're definitely right.  US deaths per capita is about to overtake Italy's.  ",2020-09-07 08:55:03.789000+00:00,2020-09-07 08:55:03.798000+00:00,1030.0,2543.0,2543,Wow thats a harsh assessment but I think youre definitely right US deaths per capita is about to overtake Italys ,negative,0.7602488398551941
1359,"@Jen Nah, I completely agree.  You know what they say about you can judge the character of a society by how they treat the weakest among them?  I think it's pretty obvious what that says about our government and about (many of) us as a nation.",2020-09-07 09:01:58.471000+00:00,2020-09-07 09:01:58.479000+00:00,717.0,2543.0,2543,Jen Nah I completely agree You know what they say about you can judge the character of a society by how they treat the weakest among them I think its pretty obvious what that says about our government and about many of us as a nation,positive,0.5815317630767822
1360,I agree 100%. It is maddening.,2020-09-07 09:09:34.087000+00:00,2020-09-07 09:09:34.994000+00:00,1030.0,2750.0,2750,I agree It is maddening,negative,0.9578260183334351
1361,We need to help those who don't have insurance. I fully support Universal healthcare,2020-09-07 09:17:36.131000+00:00,2020-09-07 09:17:36.146000+00:00,1017.0,2750.0,2750,We need to help those who dont have insurance I fully support Universal healthcare,positive,0.9249990582466125
1362,Universal health care would guarantee basic care. Nobody would have to go without care because of a job loss,2020-09-07 09:18:19.009000+00:00,2020-09-07 09:18:19.023000+00:00,1017.0,2750.0,2750,Universal health care would guarantee basic care Nobody would have to go without care because of a job loss,positive,0.5836861729621887
1363,having a handsome face is good but been alive and saving lives is the best.,2020-09-07 09:18:42.494000+00:00,2020-09-07 09:18:42.502000+00:00,864.0,2722.0,2722,having a handsome face is good but been alive and saving lives is the best,positive,0.9899288415908813
1364,There would be greater control over costs and companies would not have to our of business because of the rising cost of providing health insurance to their employees,2020-09-07 09:19:18.719000+00:00,2020-09-07 09:19:18.727000+00:00,1017.0,2750.0,2750,There would be greater control over costs and companies would not have to our of business because of the rising cost of providing health insurance to their employees,negative,0.8208075165748596
1365,Medication costs and provider services would be regulated and negotiated. No more big Pharma in control.,2020-09-07 09:20:32.778000+00:00,2020-09-07 09:20:32.786000+00:00,1017.0,2750.0,2750,Medication costs and provider services would be regulated and negotiated No more big Pharma in control,negative,0.974266767501831
1366,"That is insane, if anyone else tried to mark up their essential services or goods that high, there would be public outcry for the government to step in.  Now?  Crickets.  smdh.",2020-09-07 09:23:27.826000+00:00,2020-09-07 09:23:27.836000+00:00,929.0,2543.0,2543,That is insane if anyone else tried to mark up their essential services or goods that high there would be public outcry for the government to step in Now Crickets smdh,negative,0.5923739075660706
1367,This should be posted everywhere next to the masks required signs so people can follow directions. Good information.,2020-09-07 09:23:41.050000+00:00,2020-09-07 09:23:41.056000+00:00,783.0,2750.0,2750,This should be posted everywhere next to the masks required signs so people can follow directions Good information,negative,0.8389268517494202
1368,"@Coleman Stove, that is the most ridiculous statement I have ever heard and I'm sure you wouldn't be saying that if you saw your child laying in a hospital bed fighting for their life. ",2020-09-07 09:28:41.375000+00:00,2020-09-07 09:28:41.382000+00:00,846.0,2750.0,2750,Coleman Stove that is the most ridiculous statement I have ever heard and Im sure you wouldnt be saying that if you saw your child laying in a hospital bed fighting for their life ,negative,0.6974741816520691
1369,"Things are going to change once we get a new, respectable leader into the White House. ",2020-09-07 09:43:55.947000+00:00,2020-09-07 09:43:55.953000+00:00,655.0,2750.0,2750,Things are going to change once we get a new respectable leader into the White House ,positive,0.9237490296363831
1370,He literally rolled back everything that Obama set in place. This upcoming election is so important. ,2020-09-07 09:45:44.954000+00:00,2020-09-07 09:45:44.962000+00:00,1011.0,2750.0,2750,He literally rolled back everything that Obama set in place This upcoming election is so important ,positive,0.7262731790542603
1371,We are already seeing spiked in cases in colleges and Universities where mask wearing and social distancing are not being done. Each infected student can infect an older or sick person who is chronically ill or dead. ,2020-09-07 11:12:08.221000+00:00,2020-09-07 11:12:08.228000+00:00,783.0,2691.0,2691,We are already seeing spiked in cases in colleges and Universities where mask wearing and social distancing are not being done Each infected student can infect an older or sick person who is chronically ill or dead ,negative,0.9252313375473022
1372,Both,2020-09-07 11:16:25.249000+00:00,2020-09-07 11:16:25.257000+00:00,1005.0,2691.0,2691,Both,positive,0.9976364970207214
1373,How is this even legal?  The government needs to intervene for the good of ALL of us.,2020-09-07 11:26:31.574000+00:00,2020-09-07 11:26:31.585000+00:00,714.0,2541.0,2541,How is this even legal The government needs to intervene for the good of ALL of us,negative,0.8605135679244995
1374,"Seriously, tho, China was supposedly a partner and we had public health people *in Wuhan* and look what we got.  I think we should just do our own thing, we have the best scientists working on it already.",2020-09-07 11:28:07.862000+00:00,2020-09-07 11:28:08.115000+00:00,746.0,2541.0,2541,Seriously tho China was supposedly a partner and we had public health people in Wuhan and look what we got I think we should just do our own thing we have the best scientists working on it already,positive,0.5508814454078674
1375,"Hmmmm, this is making me think, I have to admit my line of reasoning is ""how could they have known what was coming?"" but when I look at this it seems they dropped the ball.",2020-09-07 11:30:14.022000+00:00,2020-09-07 11:30:14.030000+00:00,719.0,2541.0,2541,Hmmmm this is making me think I have to admit my line of reasoning is how could they have known what was coming but when I look at this it seems they dropped the ball,negative,0.9374595880508423
1376,What makes us think anyone else wants a rushed vaccine?,2020-09-07 11:30:34.510000+00:00,2020-09-07 11:30:35.409000+00:00,746.0,2691.0,2691,What makes us think anyone else wants a rushed vaccine,negative,0.9490611553192139
1377,"No way.  (Ok, I admit it, I had to google Senegal to know exactly where it even is.) That's a pretty shameful thing for a superpower like the US.  Could we have pulled it off here?  Why didn't we?",2020-09-07 11:31:30.892000+00:00,2020-09-07 11:31:30.898000+00:00,1034.0,2541.0,2541,No way Ok I admit it I had to google Senegal to know exactly where it even is Thats a pretty shameful thing for a superpower like the US Could we have pulled it off here Why didnt we,negative,0.8540534973144531
1378,"I welcome the idea of enforcing facemask in public places, we need more strict policy to fight this pandemic. The federal government need to do much more better.",2020-09-07 11:31:50.621000+00:00,2020-09-07 11:31:50.626000+00:00,846.0,2722.0,2722,I welcome the idea of enforcing facemask in public places we need more strict policy to fight this pandemic The federal government need to do much more better,positive,0.6177346706390381
1379,"Fight for your rights, man.  Happy Labor Day to you too.",2020-09-07 11:32:46.357000+00:00,2020-09-07 11:32:46.364000+00:00,1032.0,2541.0,2541,Fight for your rights man Happy Labor Day to you too,positive,0.8530493378639221
1380,Universal healthcare is a beacon of hope for those of us without good jobs.,2020-09-07 11:36:37.965000+00:00,2020-09-07 11:36:37.973000+00:00,708.0,2687.0,2687,Universal healthcare is a beacon of hope for those of us without good jobs,positive,0.9959948062896729
1381,Perhaps consider adding more facts besides WSJ links....,2020-09-07 11:36:58.708000+00:00,2020-09-07 11:36:58.714000+00:00,708.0,2687.0,2687,Perhaps consider adding more facts besides WSJ links,positive,0.6313058137893677
