id,text,createdAt,updatedAt,PostId,CommenterId,AuthorId,norm_text,labels,scores
490,"The economy. If we don't pay people to me motivated to work for protecting our environment, they will continue to be neglectful. They will only act when it is far too late",2020-09-04 15:13:31.565000+00:00,2020-09-04 15:13:32.433000+00:00,406.0,2711.0,2711,The economy If we dont pay people to me motivated to work for protecting our environment they will continue to be neglectful They will only act when it is far too late,negative,0.6463373899459839
491,Wishing you the best luck!,2020-09-04 15:15:13.590000+00:00,2020-09-04 15:15:15.037000+00:00,218.0,2691.0,2691,Wishing you the best luck,positive,0.999748170375824
492,That is SO AMAZING! Thx.,2020-09-04 15:22:00.708000+00:00,2020-09-04 15:22:00.717000+00:00,250.0,2691.0,2691,That is SO AMAZING Thx,negative,0.8771724700927734
493,"Great points, I agree that this is true. ",2020-09-04 15:22:58.012000+00:00,2020-09-04 15:22:58.021000+00:00,174.0,2687.0,2687,Great points I agree that this is true ,positive,0.9959168434143066
494,"I agree, Trump and is Admin are igniting the flames of the **Fact- denying** populism.  
  
# SAVE THE EARTH",2020-09-04 15:24:05.712000+00:00,2020-09-04 15:24:05.724000+00:00,264.0,2687.0,2687,I agree Trump and is Admin are igniting the flames of the Fact denying populism SAVE THE EARTH,negative,0.7349874973297119
495,"Great post, no evidence. ",2020-09-04 15:24:28.996000+00:00,2020-09-04 15:24:29.004000+00:00,482.0,2687.0,2687,Great post no evidence ,negative,0.9827285408973694
496,COVID is causing all this havoc. Great facts.,2020-09-04 15:25:00.342000+00:00,2020-09-04 15:25:00.351000+00:00,169.0,2687.0,2687,COVID is causing all this havoc Great facts,positive,0.8842881321907043
497,Great job posting **EVIDENCE** :),2020-09-04 15:25:40.652000+00:00,2020-09-04 15:25:43.130000+00:00,203.0,2687.0,2687,Great job posting EVIDENCE ,positive,0.9998064637184143
498,"The environment, which can ultimately have a positive impact on the economy. New energy sources/new job opportunities. ",2020-09-04 15:28:55.348000+00:00,2020-09-04 15:28:55.358000+00:00,406.0,2701.0,2701,The environment which can ultimately have a positive impact on the economy New energy sourcesnew job opportunities ,positive,0.8420850038528442
499,I hope they let you go back soon. We need to open the schools for better learning environments. ,2020-09-04 15:31:52.895000+00:00,2020-09-04 15:31:52.910000+00:00,218.0,2593.0,2593,I hope they let you go back soon We need to open the schools for better learning environments ,positive,0.5367486476898193
500,"I couldn't agree more, thank you Heather!",2020-09-04 15:34:22.337000+00:00,2020-09-04 15:34:22.351000+00:00,239.0,2593.0,2593,I couldnt agree more thank you Heather,positive,0.9367359280586243
501,"The spread is out of control, policies need to be mandated on the national level to stop the spread of COVID 19 and protect the people living in this country, U.S.. ",2020-09-04 15:36:10.908000+00:00,2020-09-04 15:36:10.919000+00:00,260.0,2701.0,2701,The spread is out of control policies need to be mandated on the national level to stop the spread of COVID and protect the people living in this country US ,negative,0.7307806611061096
502,"The U.S. needs to remain involved on a global level because things that happen in other countries can, and likely will, have an impact on the U.S.. External problems can become internal problems, ex. COVID. ",2020-09-04 15:40:45.944000+00:00,2020-09-04 15:40:45.960000+00:00,167.0,2701.0,2701,The US needs to remain involved on a global level because things that happen in other countries can and likely will have an impact on the US External problems can become internal problems ex COVID ,negative,0.960640549659729
503,yeah. ppl are basing their anti-nuclear antipathy on preconceived notions and drivel concocted by a brainless fool aka aoc,2020-09-04 15:55:28.201000+00:00,2020-09-04 15:55:28.211000+00:00,173.0,2709.0,2709,yeah ppl are basing their antinuclear antipathy on preconceived notions and drivel concocted by a brainless fool aka aoc,negative,0.9967287182807922
504,"When Trump said America First, he really meant it, now we are no.1 in Covid-19.",2020-09-04 16:01:06.365000+00:00,2020-09-04 16:01:06.381000+00:00,260.0,2601.0,2601,When Trump said America First he really meant it now we are no in Covid ,negative,0.9796147346496582
505,"Depends on how rich you are, environment for the rich, economy for the poor.",2020-09-04 16:01:49.229000+00:00,2020-09-04 16:01:49.246000+00:00,406.0,2601.0,2601,Depends on how rich you are environment for the rich economy for the poor,negative,0.8431779742240906
506,"Not really, dude stop worrying too much",2020-09-04 16:03:45.454000+00:00,2020-09-04 16:03:45.463000+00:00,252.0,2601.0,2601,Not really dude stop worrying too much,negative,0.9722307324409485
507,yes they are safe to eat,2020-09-04 16:04:52.865000+00:00,2020-09-04 16:04:52.873000+00:00,214.0,2601.0,2601,yes they are safe to eat,positive,0.9910027980804443
508,Yes they are,2020-09-04 16:05:18.199000+00:00,2020-09-04 16:05:18.206000+00:00,207.0,2601.0,2601,Yes they are,positive,0.9264960289001465
509,"sort of agree with you, don't forget Russia",2020-09-04 16:05:53.120000+00:00,2020-09-04 16:05:53.126000+00:00,206.0,2601.0,2601,sort of agree with you dont forget Russia,positive,0.7630125880241394
510,"I agree, the policy is too harsh",2020-09-04 16:06:29.871000+00:00,2020-09-04 16:06:29.878000+00:00,202.0,2601.0,2601,I agree the policy is too harsh,negative,0.9815395474433899
511,All we need is voting in Nov.,2020-09-04 16:07:36.551000+00:00,2020-09-04 16:07:36.558000+00:00,441.0,2601.0,2601,All we need is voting in Nov,negative,0.5817437171936035
512,"Totally disagree, America thrives on globalization. ",2020-09-04 16:09:40.785000+00:00,2020-09-04 16:09:41.943000+00:00,163.0,2601.0,2601,Totally disagree America thrives on globalization ,negative,0.5182176232337952
513,"No, we can't do both well. If the environment goes south the economy will soon follow.  We must take care of the environment first. ",2020-09-04 16:12:26.263000+00:00,2020-09-04 16:12:50.905000+00:00,406.0,2622.0,2622,No we cant do both well If the environment goes south the economy will soon follow We must take care of the environment first ,positive,0.9450271129608154
514,The environment will have a good impact on the economy?  When?,2020-09-04 16:12:39.914000+00:00,2020-09-04 16:12:52.092000+00:00,406.0,2658.0,2658,The environment will have a good impact on the economy When,positive,0.9494075775146484
515,The economy. We can't protect the environment if people are worried how they will keep a roof over their heads and food in their belly,2020-09-04 16:15:55.077000+00:00,2020-09-04 16:15:55.086000+00:00,406.0,2603.0,2603,The economy We cant protect the environment if people are worried how they will keep a roof over their heads and food in their belly,negative,0.6212997436523438
516,"Sea ice melting, change in weather patterns and the worsening of wildfires are proof climate change/global warming is real. We need to make changes now to save or planet. ",2020-09-04 16:15:59.519000+00:00,2020-09-04 16:15:59.529000+00:00,264.0,2701.0,2701,Sea ice melting change in weather patterns and the worsening of wildfires are proof climate changeglobal warming is real We need to make changes now to save or planet ,negative,0.5261325240135193
517,POTUS makes our country like a joke. ,2020-09-04 16:17:53.351000+00:00,2020-09-04 16:17:53.362000+00:00,441.0,2601.0,2601,POTUS makes our country like a joke ,negative,0.9980126023292542
518,Good luck!,2020-09-04 16:18:55.326000+00:00,2020-09-04 16:18:56.779000+00:00,218.0,2601.0,2601,Good luck,positive,0.9888396859169006
519,I think they are fine and science supports it!,2020-09-04 16:19:34.182000+00:00,2020-09-04 16:19:34.188000+00:00,599.0,2658.0,2658,I think they are fine and science supports it,positive,0.7921823263168335
520,Very informative post. I agree biotech is relatively safe.,2020-09-04 16:20:33.275000+00:00,2020-09-04 16:20:33.283000+00:00,599.0,2575.0,2575,Very informative post I agree biotech is relatively safe,positive,0.7302966713905334
521,"Personally, I think absolutely yes we will!",2020-09-04 16:21:47.515000+00:00,2020-09-04 16:21:47.526000+00:00,601.0,2658.0,2658,Personally I think absolutely yes we will,positive,0.9526640772819519
522,"We have much bigger problems than a terrorist attack within the next 10 years, we need to focus on repairing our economy and keeping China from further destabilizing us. ",2020-09-04 16:23:03.244000+00:00,2020-09-04 16:23:03.255000+00:00,252.0,2603.0,2603,We have much bigger problems than a terrorist attack within the next years we need to focus on repairing our economy and keeping China from further destabilizing us ,negative,0.9348541498184204
523,Really fear the radioactive waste produced by nuclear energy. Would prefer the use of renewable energy sources. ,2020-09-04 16:23:24.719000+00:00,2020-09-04 16:23:24.731000+00:00,179.0,2701.0,2701,Really fear the radioactive waste produced by nuclear energy Would prefer the use of renewable energy sources ,positive,0.5674128532409668
524,I totally agree! It's scary to think of all the ways it could go wrong.,2020-09-04 16:23:53.110000+00:00,2020-09-04 16:23:53.119000+00:00,490.0,2603.0,2603,I totally agree Its scary to think of all the ways it could go wrong,negative,0.5803977847099304
525,"I agree, we need to do much more to protect the environment than we currently are.",2020-09-04 16:24:57.136000+00:00,2020-09-04 16:24:57.143000+00:00,118.0,2603.0,2603,I agree we need to do much more to protect the environment than we currently are,negative,0.6081594824790955
526,"Yes, let people opt in or out. Something must be done!",2020-09-04 16:26:24.600000+00:00,2020-09-04 16:26:24.608000+00:00,106.0,2603.0,2603,Yes let people opt in or out Something must be done,positive,0.5444955229759216
527,"Well, while you are off saving the world, I hope we have enough military here when we need it!",2020-09-04 16:28:21.705000+00:00,2020-09-04 16:28:21.713000+00:00,600.0,2658.0,2658,Well while you are off saving the world I hope we have enough military here when we need it,positive,0.5671128034591675
528,"I agree, it's going to be worse than the recession 10 years ago. ",2020-09-04 16:28:41.620000+00:00,2020-09-04 16:28:41.627000+00:00,203.0,2603.0,2603,I agree its going to be worse than the recession years ago ,negative,0.9650304317474365
529,"Who is going to listen to us when our cities are burning, our small businesses are closing down for good, and our politicians are fighting like school children in front of the world? We need to tighten up at home and then try to save the world.",2020-09-04 16:30:20.332000+00:00,2020-09-04 16:30:20.348000+00:00,167.0,2603.0,2603,Who is going to listen to us when our cities are burning our small businesses are closing down for good and our politicians are fighting like school children in front of the world We need to tighten up at home and then try to save the world,positive,0.5685427784919739
530,we need jobs and the economy though we also need to be cognisant of the environment to some extent,2020-09-04 16:30:25.796000+00:00,2020-09-04 16:30:25.805000+00:00,406.0,2649.0,2649,we need jobs and the economy though we also need to be cognisant of the environment to some extent,positive,0.8401661515235901
531,Thanks Luke!,2020-09-04 16:31:20.576000+00:00,2020-09-04 16:31:20.585000+00:00,599.0,2658.0,2658,Thanks Luke,positive,0.6663799285888672
532,I understand covid is bad and highy contagious but we can't keep our economy shutdown. People are dying of suicides and addictions and domestic abuse too.,2020-09-04 16:33:17.280000+00:00,2020-09-04 16:33:17.296000+00:00,260.0,2649.0,2649,I understand covid is bad and highy contagious but we cant keep our economy shutdown People are dying of suicides and addictions and domestic abuse too,negative,0.867865800857544
533,"It's so scary to think you could lose almost everything, just by tripping over a curb and breaking an ankle.",2020-09-04 16:33:36.908000+00:00,2020-09-04 16:33:36.924000+00:00,240.0,2603.0,2603,Its so scary to think you could lose almost everything just by tripping over a curb and breaking an ankle,negative,0.9081303477287292
534,Not good on the nasdaq nor the dow today though it's not down as far as it was earlier,2020-09-04 16:34:28.300000+00:00,2020-09-04 16:34:28.310000+00:00,186.0,2649.0,2649,Not good on the nasdaq nor the dow today though its not down as far as it was earlier,negative,0.9881386160850525
535,"They are safe to eat, people just hear ""genetically modified"" and get nervous.",2020-09-04 16:34:57.176000+00:00,2020-09-04 16:34:57.191000+00:00,214.0,2603.0,2603,They are safe to eat people just hear genetically modified and get nervous,positive,0.5666252970695496
536,In agreement...tax reform needs more careful thought than just saying tax the wealthy,2020-09-04 16:36:58.795000+00:00,2020-09-04 16:36:58.804000+00:00,239.0,2649.0,2649,In agreementtax reform needs more careful thought than just saying tax the wealthy,negative,0.9466935396194458
537,With covid I feel we have let our guard down and open to terrorists,2020-09-04 16:38:14.140000+00:00,2020-09-04 16:38:14.156000+00:00,252.0,2649.0,2649,With covid I feel we have let our guard down and open to terrorists,negative,0.8735582828521729
538,[Check out this post for REAL evidence](http://dartpost.org/posts/599/),2020-09-04 16:38:23.936000+00:00,2020-09-04 16:38:23.944000+00:00,482.0,2658.0,2658,Check out this post for REAL evidence,negative,0.9428608417510986
539,Clean energy needs to come from various sources and implemented over years. Otherwise regulation and costs will kill many businesses.,2020-09-04 16:41:13.311000+00:00,2020-09-04 16:41:13.320000+00:00,174.0,2649.0,2649,Clean energy needs to come from various sources and implemented over years Otherwise regulation and costs will kill many businesses,negative,0.8355079889297485
540,"Yes it is time to restart the economy, schools, EVERYTHING!  Thanks.",2020-09-04 16:41:26.057000+00:00,2020-09-04 16:41:26.064000+00:00,218.0,2658.0,2658,Yes it is time to restart the economy schools EVERYTHING Thanks,negative,0.6741530895233154
541,Certainly agree!,2020-09-04 16:41:35.784000+00:00,2020-09-04 16:41:35.792000+00:00,206.0,2593.0,2593,Certainly agree,positive,0.9752289652824402
542,How do You suggest we pay for socialized medicine? ,2020-09-04 16:43:25.294000+00:00,2020-09-04 16:43:25.310000+00:00,240.0,2593.0,2593,How do You suggest we pay for socialized medicine ,negative,0.896942138671875
543,"Just beginning, hard to know what will happen next but I'm not very optimistic
",2020-09-04 16:45:05.217000+00:00,2020-09-04 16:45:05.224000+00:00,186.0,2543.0,2543,Just beginning hard to know what will happen next but Im not very optimistic ,negative,0.7282662391662598
544,"Both, it's a balancing act.",2020-09-04 16:49:31.955000+00:00,2020-09-04 16:49:31.964000+00:00,406.0,2543.0,2543,Both its a balancing act,positive,0.9964933395385742
545,"I disagree, I don't think they would miss the 2%. They've made their money through unfair tax breaks and unfair wages paid to their employees.  Time to give back for the greater good.",2020-09-04 16:50:52.131000+00:00,2020-09-04 16:50:52.143000+00:00,202.0,2543.0,2543,I disagree I dont think they would miss the Theyve made their money through unfair tax breaks and unfair wages paid to their employees Time to give back for the greater good,negative,0.9643349647521973
546,I agree.  Tax the wealthy!,2020-09-04 16:52:27.271000+00:00,2020-09-04 16:52:27.278000+00:00,251.0,2543.0,2543,I agree Tax the wealthy,negative,0.809899628162384
547,"I think if the government had treated this threat seriously at the beginning, we would have lower mortality and less damage to the economy. Now we're dealing with both.  It's been such a failure.",2020-09-04 16:53:53.831000+00:00,2020-09-04 16:53:53.850000+00:00,260.0,2543.0,2543,I think if the government had treated this threat seriously at the beginning we would have lower mortality and less damage to the economy Now were dealing with both Its been such a failure,negative,0.9898091554641724
548,"I'd really like to see the Green New Deal implemented as it's gonna work on both the environment and the economy.  I don't think it has a chance, but such good thinking.",2020-09-04 16:55:53.039000+00:00,2020-09-04 16:55:53.051000+00:00,171.0,2543.0,2543,Id really like to see the Green New Deal implemented as its gonna work on both the environment and the economy I dont think it has a chance but such good thinking,positive,0.8234037756919861
549,"It was a much better alternative to coal, but compared to wind and solar, not a good option.  Going forward I think we should phase out nuclear and go completely green.  And I say this as someone who's lived in a nuclear accident zone.  ",2020-09-04 16:58:05.941000+00:00,2020-09-04 16:58:05.949000+00:00,173.0,2543.0,2543,It was a much better alternative to coal but compared to wind and solar not a good option Going forward I think we should phase out nuclear and go completely green And I say this as someone whos lived in a nuclear accident zone ,negative,0.8451318144798279
550,This is crazy.  How can the government not do more to keep people safe?,2020-09-04 16:59:28.499000+00:00,2020-09-04 16:59:28.508000+00:00,488.0,2543.0,2543,This is crazy How can the government not do more to keep people safe,negative,0.8149042725563049
551,"agreed.  Stay safe, people!",2020-09-04 17:01:16.358000+00:00,2020-09-04 17:01:16.374000+00:00,120.0,2543.0,2543,agreed Stay safe people,positive,0.7736913561820984
552,"Aw, that house makes me sad, but you've got a point there.",2020-09-04 17:06:37.519000+00:00,2020-09-04 17:06:37.527000+00:00,606.0,2542.0,2542,Aw that house makes me sad but youve got a point there,positive,0.8765469789505005
553,@Dustin_3915 What is your source for this? It seems random to speculate about how vaccines are related to the stock market.,2020-09-04 17:07:27.086000+00:00,2020-09-04 17:07:27.097000+00:00,203.0,2638.0,2638,Dustin What is your source for this It seems random to speculate about how vaccines are related to the stock market,negative,0.8348256349563599
554,"Lol, I can't keep track of what month it is, seriously.  Covid got the whole year mixed up.",2020-09-04 17:07:43.957000+00:00,2020-09-04 17:07:43.971000+00:00,604.0,2542.0,2542,Lol I cant keep track of what month it is seriously Covid got the whole year mixed up,positive,0.5468908548355103
555,"@Heather_1039 You mention a lack of evidence, but then state that this recession will be worse than the one 10 years ago. Do you see the irony?
",2020-09-04 17:08:18.195000+00:00,2020-09-04 17:08:18.205000+00:00,203.0,2638.0,2638,Heather You mention a lack of evidence but then state that this recession will be worse than the one years ago Do you see the irony ,negative,0.9798222780227661
556,At least CNN is a credible source. Others seem to make things up as they wish without actual evidence.,2020-09-04 17:09:09.120000+00:00,2020-09-04 17:09:09.130000+00:00,203.0,2638.0,2638,At least CNN is a credible source Others seem to make things up as they wish without actual evidence,negative,0.6822972893714905
557,I would need to know more about specifically how the taxes collected would be used. Many times we hear about these taxes but don't actually see where the money is going.,2020-09-04 17:10:55.956000+00:00,2020-09-04 17:10:55.968000+00:00,97.0,2638.0,2638,I would need to know more about specifically how the taxes collected would be used Many times we hear about these taxes but dont actually see where the money is going,negative,0.8512200117111206
558,"@Hannah_8848  You can't really say that the rich never pay their taxes. If that were true, how would the government collect enough money to pay for anything?
",2020-09-04 17:12:04.063000+00:00,2020-09-04 17:12:04.083000+00:00,97.0,2638.0,2638,Hannah You cant really say that the rich never pay their taxes If that were true how would the government collect enough money to pay for anything ,negative,0.9666014313697815
559,"@Jenna_5040  The wealth gap is enormous because of our capitalist system. If we want to prosper through capitalism, we have to accept its faults as well. We can't have it both ways.",2020-09-04 17:13:18.106000+00:00,2020-09-04 17:13:19.423000+00:00,97.0,2638.0,2638,Jenna The wealth gap is enormous because of our capitalist system If we want to prosper through capitalism we have to accept its faults as well We cant have it both ways,negative,0.6671188473701477
560,@Kathryn_3504 Saying that you want to punish others because you cannot relate to them is a dangerous way of thinking. How would you feel if the mega-rich were tasked to make the same decision about you and said that they could care less?,2020-09-04 17:15:15.026000+00:00,2020-09-04 17:15:15.624000+00:00,97.0,2638.0,2638,Kathryn Saying that you want to punish others because you cannot relate to them is a dangerous way of thinking How would you feel if the megarich were tasked to make the same decision about you and said that they could care less,negative,0.9244304299354553
561,"People need to realize that people ""making 50 million dollars"" are not actually taking home anywhere near that amount at the end of the day.",2020-09-04 17:15:45.637000+00:00,2020-09-04 17:15:45.644000+00:00,251.0,2638.0,2638,People need to realize that people making million dollars are not actually taking home anywhere near that amount at the end of the day,negative,0.7003485560417175
562,"It's kind of astounding the level of corruption we're seeing, and it's so heartbreaking in the environment because it will take years to undo, if it's possible.",2020-09-04 17:17:39.267000+00:00,2020-09-04 17:17:39.275000+00:00,441.0,2542.0,2542,Its kind of astounding the level of corruption were seeing and its so heartbreaking in the environment because it will take years to undo if its possible,negative,0.638728141784668
563,"I always try to be so careful what I give me kids, I'd rather be safe than sorry, and it's true, sometimes we don't know the full picture for decades.",2020-09-04 17:19:08.260000+00:00,2020-09-04 17:19:08.276000+00:00,482.0,2542.0,2542,I always try to be so careful what I give me kids Id rather be safe than sorry and its true sometimes we dont know the full picture for decades,negative,0.5060538053512573
564,China is getting away with too much these days. People need to pay attention before it is too late.,2020-09-04 17:23:09.674000+00:00,2020-09-04 17:23:11.020000+00:00,206.0,2638.0,2638,China is getting away with too much these days People need to pay attention before it is too late,negative,0.9684345722198486
565,My parents depend on Social Security and we need to save it.  I think a 2% tax that would help fund Social Security is a great idea,2020-09-04 17:27:03.134000+00:00,2020-09-04 17:27:03.147000+00:00,115.0,2542.0,2542,My parents depend on Social Security and we need to save it I think a tax that would help fund Social Security is a great idea,negative,0.6006637215614319
566,That is so sad.  We need to do better to protect people!!,2020-09-04 17:30:22.985000+00:00,2020-09-04 17:30:22.994000+00:00,488.0,2542.0,2542,That is so sad We need to do better to protect people,negative,0.9521515965461731
567,"Agreeing with Heather_1039, it's a bit hypocritical to tell people how to run their countries when we clearly are having issues with ours.",2020-09-04 17:36:14.954000+00:00,2020-09-04 17:36:14.970000+00:00,167.0,2542.0,2542,Agreeing with Heather its a bit hypocritical to tell people how to run their countries when we clearly are having issues with ours,negative,0.8800802826881409
568,"Thank you for your valuable comments, Amy and Heather!",2020-09-04 17:40:29.631000+00:00,2020-09-04 17:40:29.642000+00:00,167.0,2593.0,2593,Thank you for your valuable comments Amy and Heather,positive,0.9573858976364136
569,why does it take a pandemic to get us to have cleaner air?,2020-09-04 17:41:04.733000+00:00,2020-09-04 17:41:04.747000+00:00,492.0,2542.0,2542,why does it take a pandemic to get us to have cleaner air,negative,0.9055187106132507
570,"I understand the need everyone has for healthcare, however; who is going to pay for this plan. As it is medicare and social security is underfunded. Obamacare ended up not working well and doctors/hospitals certainly don't support universal healthcare. ",2020-09-04 17:41:54.165000+00:00,2020-09-04 17:41:55.328000+00:00,577.0,2649.0,2649,I understand the need everyone has for healthcare however who is going to pay for this plan As it is medicare and social security is underfunded Obamacare ended up not working well and doctorshospitals certainly dont support universal healthcare ,positive,0.5301913619041443
571,"Jacob_5538 and Carly_8867 why does it bother you that everyone would have access to health care?  Other rich nations spend far less than we do on health care and have better results.  To me that sounds like a wise use of resources, not socialism.",2020-09-04 17:42:02.057000+00:00,2020-09-04 17:42:02.962000+00:00,150.0,2542.0,2542,Jacob and Carly why does it bother you that everyone would have access to health care Other rich nations spend far less than we do on health care and have better results To me that sounds like a wise use of resources not socialism,negative,0.8042154312133789
572,"This is just wrong, man. The government needs to do something.",2020-09-04 17:46:48.763000+00:00,2020-09-04 17:46:48.771000+00:00,488.0,2544.0,2544,This is just wrong man The government needs to do something,negative,0.9440457224845886
573,Mutant food?,2020-09-04 17:47:14.742000+00:00,2020-09-04 17:47:14.756000+00:00,439.0,2649.0,2649,Mutant food,negative,0.9724044799804688
